167	Vražda a zabití nástroji řeznými a bodnými osob ve věku 1 rok a vyšším	3	-	-	-	-	1	-	2	-	-	-	-
168a	Jiné vraždy a zabití osob ve věku 1 rok a vyšším: jiným způsobem	4	-	1	2	-	-	-	-	-	1	-	-
168b	Jiné vraždy a zabití osob ve věku 1 rok a vyšším: způsobem blíže neoznačeným	4	-	-	1	1	-	1	1	-	-	-	-
	Úrazy	1429	14	129	115	200	204	235	170	157	123	82	-
DN	Úrazy při dopravě	292	-	13	19	36	47	64	59	27	18	9	-
169a	Úrazy způsobené železnicí: poranění zaměstnanců	74	-	-	-	8	16	25	22	3	-	-	-
169b	Úrazy způsobené železnicí: ostatních osob	80	-	-	2	13	14	13	14	11	9	4	-
170a	Úrazy způsobené motorovými vozidly: při srážce se železnicí	9	-	-	-	-	1	2	4	1	1	-	-
170b	Úrazy způsobené motorovými vozidly: při srážce s jinými motorovými vozid	1	-	-	-	-	-	-	-	1	-	-	-
170c	Úrazy způsobené motorovými vozidly: při srážce s jinými dopravními prostředky	-	-	-	-	-	-	-	-	-	-	-	-
170d	Úrazy způsobené motorovými vozidly: nárazem, vymrštěním a převrhnutím těchto motorových vozidel	4	-	-	-	-	2	1	-	1	-	-	-
170	Úrazy způsobené motorovými vozidly: přejetím	44	-	8	13	5	2	7	6	1	1	1	-
170f	Ostatní a blíže neoznačené úrazy motorovými vozidly	42	-	-	1	5	7	11	10	1	4	3	-
171a	Ostatní úrazy při pouliční dopravě:srážka s ostatními vozidly	4	-	-	-	-	2	1	-	-	1	-	-
171b	Ostatní úrazy při pouliční dopravě: nárazem, vymrštěním,  převrhnutím těchto motrových vozidel	21	-	3	1	3	2	3	3	5	1	-	-
171c	Ostatní úrazy při pouliční dopravě: přejetím těmito vozidly	11	-	2	2	1	1	-	-	3	1	1	-
172a	Úrazy při dopravě po vodě: utonutím pádem do vody a potopením	-	-	-	-	-	-	-	-	-	-	-	-
172b	Úrazy při dopravě po vodě: ostatní úrazy	1	-	-	-	1	-	-	-	-	-	-	-
173a	Úrazy při dopravě vzduchem: letadly	-	-	-	-	-	-	-	-	-	-	-	-
173b	Úrazy při dopravě vzduchem:  kluzáky	-	-	-	-	-	-	-	-	-	-	-	-
173c	Úrazy při dopravě vzduchem:  při seskoku padákem	-	-	-	-	-	-	-	-	-	-	-	-
173d	Úrazy při dopravě vzduchem:  jiné letecké úrazy	1	-	-	-	-	-	1	-	-	-	-	-
174	Úrazy v dolech a lomech	79	-	-	1	12	15	25	11	10	5	-	-
175a	Úrazy při zemědělství a lesnictví: hospodářskými stroji nebo vozidly (nikoli při dopravě silniční	27	-	-	-	3	-	7	1	6	9	1	-
175b	Úrazy při zemědělství a lesnictví:  jedovatými zvířaty	-	-	-	-	-	-	-	-	-	-	-	-
175c	Úrazy při zemědělství a lesnictví:  ostaními zvířaty	14	-	-	-	1	-	4	3	2	3	1	-
175d	Úrazy při zemědělství a lesnictví:  ostatní úrazy	29	-	-	1	3	6	6	4	5	2	2	-
176	Úrazy způsobené stroji	13	-	2	-	1	1	3	2	3	1	-	-
177a	Otrava potravinami: otrava houbami	4	-	-	2	-	1	-	1	-	-	-	-
177b	Otrava ostatními potravinami	3	-	-	1	-	-	1	-	-	1	-	-
178a	Vdechování jedovatých plynů: svítiplynu	5	-	-	1	-	2	1	-	1	-	-	-
178b	Vdechování ostatních jedovatých plynů	27	-	-	-	7	6	1	1	4	6	2	-
179	Jiné prudké otravy, vyjma otravy plynem	36	-	6	1	6	2	5	5	5	4	2	-
180	Následky požáru	4	1	-	1	-	-	-	-	1	-	1	-
181	Popálení a opaření (nikoliv při požáru)	106	5	51	7	8	4	15	4	2	6	4	-
182	Mechanické zadušení	18	3	3	2	-	3	2	-	2	1	2	-
183	Utopení	165	2	35	37	49	19	7	3	2	7	4	-
184	Poranění střelnými zbraněmi	41	-	-	5	9	14	6	6	1	-	-	-
185	Poranění nástroji řeznými a bodnými	8	-	1	-	1	2	-	1	3	-	-	-
186a	Poranění pádem, rozdrcením, sřícením: pádem s výše	48	1	1	8	7	4	5	5	6	8	3	-
186b	Poranění pádem, rozdrcením, sřícením: rozdrcením	18	-	-	4	1	1	3	4	3	1	1	-
186c	Poranění pádem, rozdrcením, sřícením: upadnutím, uklouznutím	30	-	2	1	-	2	-	2	5	6	12	-
187	Poranění při živelných pohromách	-	-	-	-	-	-	-	-	-	-	-	-
188	Poranění způsobená zvířaty	4	-	-	1	1	-	-	-	1	-	1	-
189	Vyhladovění, žízeň	-	-	-	-	-	-	-	-	-	-	-	-
190	Neobvyklá zima	4	-	-	-	-	-	-	2	1	1	-	-
191	Neobvyklé teplo	2	-	-	-	-	-	-	1	1	-	-	-
192	Poranění bleskem	11	-	-	1	-	1	7	-	1	1	-	-
193	Úrazy způsobené elektrickým proudem	34	-	3	6	13	7	1	3	1	-	-	-
194	Úrazy způsobené jedovatými zvířaty	1	-	-	-	-	1	-	-	-	-	-	-
195	Jiné úrazy nebo zevní příčiny	372	2	11	16	38	59	64	46	61	40	35	-
196	Úmrtí vojenských osob při válečných akcích	-	-	-	-	-	-	-	-	-	-	-	-
197	Úmrtí civilních osob při válečných akcích	34	-	1	-	4	7	8	6	3	3	2	-
198a	Soudní poprava	342	-	-	-	26	109	105	72	25	4	1	-
198b	Smrt ve vězení a následky vězení	-	-	-	-	-	-	-	-	-	-	-	-
													
XVIII	Neurčité příčiny smrti	299	17	9	1	9	19	41	40	94	45	24	-
199	Náhlá smrt	21	4	-	1	-	1	2	2	6	4	1	-
200a	Blíže neoznačené nebo nedostatečně určené příčiny: mrtvice, srdeční slabost, ochrnutí srdce bez jakéhokoliv vysvětlujícího údaje	143	2	-	-	4	6	19	25	44	29	14	-
200b	Blíže neoznačené nebo nedostatečně určené příčiny: ostatní nedostatečně udané příčiny	133	11	9	-	5	12	19	13	43	12	9	-
200c	Blíže neoznačené nebo nedostatečně určené příčiny: nalezené mrtvoly, u nichž je příčina smrti neznáma	2	-	-	-	-	-	1	-	1	-	-	-
