168a	Jiné vrady a zabití osob ve vìku 1 rok a vyšším: jinım zpùsobem	21	-	1	5	3	-	3	3	1	4	1	-
168b	Jiné vrady a zabití osob ve vìku 1 rok a vyšším: zpùsobem blíe neoznaèenım	10	-	-	-	1	1	2	1	3	2	-	-
	Úrazy	1236	21	116	119	159	95	121	144	141	159	151	10
DN	Úrazy pøi dopravì	302	3	14	32	50	23	41	44	33	43	18	1
169a	Úrazy zpùsobené eleznicí: poranìní zamìstnancù	3	-	-	-	1	1	1	-	-	-	-	-
169b	Úrazy zpùsobené eleznicí: ostatních osob	71	1	-	3	17	8	11	11	9	7	4	-
170a	Úrazy zpùsobené motorovımi vozidly: pøi sráce se eleznicí	3	-	-	-	2	-	1	-	-	-	-	-
170b	Úrazy zpùsobené motorovımi vozidly: pøi sráce s jinımi motorovımi vozid	4	-	-	1	1	-	1	1	-	-	-	-
170c	Úrazy zpùsobené motorovımi vozidly: pøi sráce s jinımi dopravními prostøedky	1	-	-	-	1	-	-	-	-	-	-	-
170d	Úrazy zpùsobené motorovımi vozidly: nárazem, vymrštìním a pøevrhnutím tìchto motorovıch vozidel	66	1	1	4	7	5	10	16	8	10	4	-
170	Úrazy zpùsobené motorovımi vozidly: pøejetím	72	-	7	9	10	3	5	10	7	16	5	-
170f	Ostatní a blíe neoznaèené úrazy motorovımi vozidly	51	-	3	12	7	2	9	4	4	6	3	1
171a	Ostatní úrazy pøi poulièní dopravì:sráka s ostatními vozidly	2	-	-	-	1	-	-	1	-	-	-	-
171b	Ostatní úrazy pøi poulièní dopravì: nárazem, vymrštìním,  pøevrhnutím tìchto motrovıch vozidel	15	1	1	1	2	-	2	-	3	4	1	-
171c	Ostatní úrazy pøi poulièní dopravì: pøejetím tìmito vozidly	10	-	2	2	-	1	1	1	2	-	1	-
172a	Úrazy pøi dopravì po vodì: utonutím pádem do vody a potopením	-	-	-	-	-	-	-	-	-	-	-	-
172b	Úrazy pøi dopravì po vodì: ostatní úrazy	3	-	-	-	-	3	-	-	-	-	-	-
173a	Úrazy pøi dopravì vzduchem: letadly	-	-	-	-	-	-	-	-	-	-	-	-
173b	Úrazy pøi dopravì vzduchem:  kluzáky	-	-	-	-	-	-	-	-	-	-	-	-
173c	Úrazy pøi dopravì vzduchem:  pøi seskoku padákem	-	-	-	-	-	-	-	-	-	-	-	-
173d	Úrazy pøi dopravì vzduchem:  jiné letecké úrazy	1	-	-	-	1	-	-	-	-	-	-	-
174	Úrazy v dolech a lomech	3	-	-	-	-	-	2	1	-	-	-	-
175a	Úrazy pøi zemìdìlství a lesnictví: hospodáøskımi stroji nebo vozidly (nikoli pøi dopravì silnièní	6	-	-	-	2	-	1	1	1	1	-	-
175b	Úrazy pøi zemìdìlství a lesnictví:  jedovatımi zvíøaty	-	-	-	-	-	-	-	-	-	-	-	-
175c	Úrazy pøi zemìdìlství a lesnictví:  ostaními zvíøaty	3	-	-	-	-	-	-	1	-	1	1	-
175d	Úrazy pøi zemìdìlství a lesnictví:  ostatní úrazy	3	-	-	-	-	-	1	1	-	-	1	-
176	Úrazy zpùsobené stroji	3	-	-	-	-	-	1	2	-	-	-	-
177a	Otrava potravinami: otrava houbami	8	-	-	2	2	1	1	1	1	-	-	-
177b	Otrava ostatními potravinami	5	-	-	1	-	2	2	-	-	-	-	-
178a	Vdechování jedovatıch plynù: svítiplynu	17	-	-	-	2	4	-	-	4	3	4	-
178b	Vdechování ostatních jedovatıch plynù	24	-	-	1	4	4	2	3	1	3	6	-
179	Jiné prudké otravy, vyjma otravy plynem	33	-	2	-	3	6	3	9	2	4	2	2
180	Následky poáru	9	-	-	-	-	-	-	-	2	2	5	-
181	Popálení a opaøení (nikoliv pøi poáru)	113	9	36	9	9	11	6	8	8	6	11	-
182	Mechanické zadušení	19	6	3	1	1	1	-	3	1	3	-	-
183	Utopení	84	-	35	13	7	2	5	-	4	5	10	3
184	Poranìní støelnımi zbranìmi	195	1	11	41	50	17	15	31	15	10	2	2
185	Poranìní nástroji øeznımi a bodnımi	4	-	-	-	-	1	2	-	1	-	-	-
186a	Poranìní pádem, rozdrcením, søícením: pádem s vıše	34	-	1	1	-	4	-	3	9	11	5	-
186b	Poranìní pádem, rozdrcením, søícením: rozdrcením	9	-	1	1	1	1	1	1	1	1	1	-
186c	Poranìní pádem, rozdrcením, søícením: upadnutím, uklouznutím	20	1	-	-	-	-	-	-	1	8	10	-
187	Poranìní pøi ivelnıch pohromách	1	-	-	-	-	-	-	1	-	-	-	-
188	Poranìní zpùsobená zvíøaty	1	-	-	1	-	-	-	-	-	-	-	-
189	Vyhladovìní, ízeò	-	-	-	-	-	-	-	-	-	-	-	-
190	Neobvyklá zima	9	-	-	-	-	1	-	2	2	2	2	-
191	Neobvyklé teplo	1	-	-	-	-	-	-	1	-	-	-	-
192	Poranìní bleskem	7	-	-	1	2	-	-	-	2	1	1	-
193	Úrazy zpùsobené elektrickım proudem	18	1	-	2	6	1	2	4	1	1	-	-
194	Úrazy zpùsobené jedovatımi zvíøaty	-	-	-	-	-	-	-	-	-	-	-	-
195	Jiné úrazy nebo zevní pøíèiny	305	-	13	13	20	16	36	27	52	54	72	2
196	Úmrtí vojenskıch osob pøi váleènıch akcích	6	-	-	-	-	5	-	-	-	1	-	-
197	Úmrtí civilních osob pøi váleènıch akcích	3006	33	125	269	466	354	543	444	356	243	109	64
198a	Soudní poprava	37	-	-	-	1	6	13	13	4	-	-	-
198b	Smrt ve vìzení a následky vìzení	5	-	-	1	2	2	-	-	-	-	-	-
													
XVIII	Neurèité pøíèiny smrti	511	3	25	11	16	29	35	71	138	101	59	23
199	Náhlá smrt	11	-	-	-	-	1	2	2	1	-	5	-
200a	Blíe neoznaèené nebo nedostateènì urèené pøíèiny: mrtvice, srdeèní slabost, ochrnutí srdce bez jakéhokoliv vysvìtlujícího údaje	260	1	4	4	7	6	18	33	61	83	42	1
200b	Blíe neoznaèené nebo nedostateènì urèené pøíèiny: ostatní nedostateènì udané pøíèiny	236	2	21	7	9	22	15	36	76	18	12	18
200c	Blíe neoznaèené nebo nedostateènì urèené pøíèiny: nalezené mrtvoly, u nich je pøíèina smrti neznáma	4	-	-	-	-	-	-	-	-	-	-	4
