166,Vražda a zabití střelnou zbraní osob ve věku 1 rok a vyšším,1,-,-,-,1,-,-,-,-,-,-,-
167,Vražda a zabití nástroji řeznými a bodnými osob ve věku 1 rok a vyšším,1,-,-,-,1,-,-,-,-,-,-,-
168a,Jiné vraždy a zabití osob ve věku 1 rok a vyšším: jiným způsobem,3,-,-,2,-,-,-,-,1,-,-,-
168b,Jiné vraždy a zabití osob ve věku 1 rok a vyšším: způsobem blíže neoznačeným,3,-,-,-,-,2,-,1,-,-,-,-
,Úrazy,645,15,92,39,73,43,64,57,66,80,116,-
DN,Úrazy při dopravě,114,1,5,11,18,7,20,12,13,18,9,-
169a,Úrazy způsobené železnicí: poranění zaměstnanců,3,-,-,-,1,1,1,-,-,-,-,-
169b,Úrazy způsobené železnicí: ostatních osob,52,1,3,2,8,3,14,5,5,8,3,-
170a,Úrazy způsobené motorovými vozidly: při srážce se železnicí,8,-,-,1,-,1,2,2,1,1,-,-
170b,Úrazy způsobené motorovými vozidly: při srážce s jinými motorovými vozid,-,-,-,-,-,-,-,-,-,-,-,-
170c,Úrazy způsobené motorovými vozidly: při srážce s jinými dopravními prostředky,2,-,-,-,-,1,-,-,-,1,-,-
170d,"Úrazy způsobené motorovými vozidly: nárazem, vymrštěním a převrhnutím těchto motorových vozidel",-,-,-,-,-,-,-,-,-,-,-,-
170,Úrazy způsobené motorovými vozidly: přejetím,13,-,2,4,-,-,1,-,2,1,3,-
170f,Ostatní a blíže neoznačené úrazy motorovými vozidly,23,-,-,2,6,1,2,3,2,5,2,-
171a,Ostatní úrazy při pouliční dopravě:srážka s ostatními vozidly,-,-,-,-,-,-,-,-,-,-,-,-
171b,"Ostatní úrazy při pouliční dopravě: nárazem, vymrštěním,  převrhnutím těchto motrových vozidel",7,-,-,1,3,-,-,1,2,-,-,-
171c,Ostatní úrazy při pouliční dopravě: přejetím těmito vozidly,6,-,-,1,-,-,-,1,1,2,1,-
172a,Úrazy při dopravě po vodě: utonutím pádem do vody a potopením,-,-,-,-,-,-,-,-,-,-,-,-
172b,Úrazy při dopravě po vodě: ostatní úrazy,-,-,-,-,-,-,-,-,-,-,-,-
173a,Úrazy při dopravě vzduchem: letadly,-,-,-,-,-,-,-,-,-,-,-,-
173b,Úrazy při dopravě vzduchem:  kluzáky,-,-,-,-,-,-,-,-,-,-,-,-
173c,Úrazy při dopravě vzduchem:  při seskoku padákem,-,-,-,-,-,-,-,-,-,-,-,-
173d,Úrazy při dopravě vzduchem:  jiné letecké úrazy,-,-,-,-,-,-,-,-,-,-,-,-
174,Úrazy v dolech a lomech,1,-,-,-,-,-,-,1,-,-,-,-
175a,Úrazy při zemědělství a lesnictví: hospodářskými stroji nebo vozidly (nikoli při dopravě silniční,6,-,-,-,-,-,-,3,1,2,-,-
175b,Úrazy při zemědělství a lesnictví:  jedovatými zvířaty,-,-,-,-,-,-,-,-,-,-,-,-
175c,Úrazy při zemědělství a lesnictví:  ostaními zvířaty,-,-,-,-,-,-,-,-,-,-,-,-
175d,Úrazy při zemědělství a lesnictví:  ostatní úrazy,5,-,-,-,1,-,1,1,1,-,1,-
176,Úrazy způsobené stroji,1,-,1,-,-,-,-,-,-,-,-,-
177a,Otrava potravinami: otrava houbami,2,-,1,-,-,-,-,1,-,-,-,-
177b,Otrava ostatními potravinami,6,-,1,-,1,1,1,1,-,1,-,-
178a,Vdechování jedovatých plynů: svítiplynu,2,-,-,-,1,-,-,-,-,1,-,-
178b,Vdechování ostatních jedovatých plynů,39,-,2,1,8,2,5,3,7,9,2,-
179,"Jiné prudké otravy, vyjma otravy plynem",17,-,2,1,1,2,6,2,2,1,-,-
180,Následky požáru,2,-,1,-,-,-,-,-,-,-,1,-
181,Popálení a opaření (nikoliv při požáru),127,7,41,7,10,9,6,6,8,6,27,-
182,Mechanické zadušení,12,7,4,-,-,1,-,-,-,-,-,-
183,Utopení,65,-,26,8,11,1,2,2,4,5,6,-
184,Poranění střelnými zbraněmi,3,-,-,1,1,-,1,-,-,-,-,-
185,Poranění nástroji řeznými a bodnými,3,-,-,2,1,-,-,-,-,-,-,-
186a,"Poranění pádem, rozdrcením, sřícením: pádem s výše",21,-,2,-,3,1,1,-,5,6,3,-
186b,"Poranění pádem, rozdrcením, sřícením: rozdrcením",2,-,-,-,-,-,1,-,1,-,-,-
186c,"Poranění pádem, rozdrcením, sřícením: upadnutím, uklouznutím",21,-,1,-,-,-,-,3,4,6,7,-
187,Poranění při živelných pohromách,-,-,-,-,-,-,-,-,-,-,-,-
188,Poranění způsobená zvířaty,-,-,-,-,-,-,-,-,-,-,-,-
189,"Vyhladovění, žízeň",-,-,-,-,-,-,-,-,-,-,-,-
190,Neobvyklá zima,9,-,-,-,1,1,-,-,1,2,4,-
191,Neobvyklé teplo,2,-,-,-,-,-,-,1,-,1,-,-
192,Poranění bleskem,7,-,-,-,-,3,2,-,2,-,-,-
193,Úrazy způsobené elektrickým proudem,4,-,-,-,1,1,2,-,-,-,-,-
194,Úrazy způsobené jedovatými zvířaty,-,-,-,-,-,-,-,-,-,-,-,-
195,Jiné úrazy nebo zevní příčiny,154,-,3,8,13,11,9,21,15,20,54,-
196,Úmrtí vojenských osob při válečných akcích,-,-,-,-,-,-,-,-,-,-,-,-
197,Úmrtí civilních osob při válečných akcích,20,-,2,-,2,3,7,-,2,2,2,-
198a,Soudní poprava,27,-,-,-,3,8,6,7,3,-,-,-
198b,Smrt ve vězení a následky vězení,-,-,-,-,-,-,-,-,-,-,-,-
,,,,,,,,,,,,,
XVIII,Neurčité příčiny smrti,209,8,3,2,6,4,14,20,75,47,30,-
199,Náhlá smrt,15,4,1,-,-,-,2,2,3,3,-,-
200a,"Blíže neoznačené nebo nedostatečně určené příčiny: mrtvice, srdeční slabost, ochrnutí srdce bez jakéhokoliv vysvětlujícího údaje",108,1,2,1,3,1,8,7,23,36,26,-
200b,Blíže neoznačené nebo nedostatečně určené příčiny: ostatní nedostatečně udané příčiny,86,3,-,1,3,3,4,11,49,8,4,-
200c,"Blíže neoznačené nebo nedostatečně určené příčiny: nalezené mrtvoly, u nichž je příčina smrti neznáma",-,-,-,-,-,-,-,-,-,-,-,-