167,Vražda a zabití nástroji řeznými a bodnými osob ve věku 1 rok a vyšším,6,-,-,-,2,-,4,-,-,-,-,-
168a,Jiné vraždy a zabití osob ve věku 1 rok a vyšším: jiným způsobem,11,-,2,1,-,4,1,1,1,-,1,-
168b,Jiné vraždy a zabití osob ve věku 1 rok a vyšším: způsobem blíže neoznačeným,3,-,1,1,-,-,-,1,-,-,-,-
,Úrazy,1267,22,107,109,198,128,154,167,139,120,122,1
DN,Úrazy při dopravě,110,-,11,14,17,13,8,13,12,12,10,-
169a,Úrazy způsobené železnicí: poranění zaměstnanců,3,-,-,-,1,-,-,-,1,-,1,-
169b,Úrazy způsobené železnicí: ostatních osob,33,-,-,2,5,5,4,3,1,6,7,-
170a,Úrazy způsobené motorovými vozidly: při srážce se železnicí,-,-,-,-,-,-,-,-,-,-,-,-
170b,Úrazy způsobené motorovými vozidly: při srážce s jinými motorovými vozid,1,-,-,-,-,-,-,-,-,-,1,-
170c,Úrazy způsobené motorovými vozidly: při srážce s jinými dopravními prostředky,2,-,-,1,1,-,-,-,-,-,-,-
170d,"Úrazy způsobené motorovými vozidly: nárazem, vymrštěním a převrhnutím těchto motorových vozidel",9,-,-,1,3,2,-,1,1,1,-,-
170,Úrazy způsobené motorovými vozidly: přejetím,19,-,4,1,-,1,1,3,4,5,-,-
170f,Ostatní a blíže neoznačené úrazy motorovými vozidly,24,-,3,7,2,4,1,4,2,-,1,-
171a,Ostatní úrazy při pouliční dopravě:srážka s ostatními vozidly,1,-,-,-,-,-,-,-,1,-,-,-
171b,"Ostatní úrazy při pouliční dopravě: nárazem, vymrštěním,  převrhnutím těchto motrových vozidel",13,-,1,2,4,1,2,2,1,-,-,-
171c,Ostatní úrazy při pouliční dopravě: přejetím těmito vozidly,5,-,3,-,1,-,-,-,1,-,-,-
172a,Úrazy při dopravě po vodě: utonutím pádem do vody a potopením,-,-,-,-,-,-,-,-,-,-,-,-
172b,Úrazy při dopravě po vodě: ostatní úrazy,-,-,-,-,-,-,-,-,-,-,-,-
173a,Úrazy při dopravě vzduchem: letadly,-,-,-,-,-,-,-,-,-,-,-,-
173b,Úrazy při dopravě vzduchem:  kluzáky,-,-,-,-,-,-,-,-,-,-,-,-
173c,Úrazy při dopravě vzduchem:  při seskoku padákem,-,-,-,-,-,-,-,-,-,-,-,-
173d,Úrazy při dopravě vzduchem:  jiné letecké úrazy,-,-,-,-,-,-,-,-,-,-,-,-
174,Úrazy v dolech a lomech,3,-,-,-,1,-,-,-,1,1,-,-
175a,Úrazy při zemědělství a lesnictví: hospodářskými stroji nebo vozidly (nikoli při dopravě silniční,4,-,-,-,-,1,-,2,1,-,-,-
175b,Úrazy při zemědělství a lesnictví:  jedovatými zvířaty,-,-,-,-,-,-,-,-,-,-,-,-
175c,Úrazy při zemědělství a lesnictví:  ostaními zvířaty,3,-,-,-,-,-,-,1,1,1,-,-
175d,Úrazy při zemědělství a lesnictví:  ostatní úrazy,6,-,-,-,-,1,-,1,2,2,-,-
176,Úrazy způsobené stroji,2,-,2,-,-,-,-,-,-,-,-,-
177a,Otrava potravinami: otrava houbami,22,-,3,3,3,1,1,9,1,1,-,-
177b,Otrava ostatními potravinami,3,-,-,1,-,-,-,-,1,1,-,-
178a,Vdechování jedovatých plynů: svítiplynu,3,-,-,-,-,-,-,-,-,1,2,-
178b,Vdechování ostatních jedovatých plynů,27,-,1,3,5,1,2,4,4,2,5,-
179,"Jiné prudké otravy, vyjma otravy plynem",20,-,2,3,3,3,2,2,2,2,1,-
180,Následky požáru,1,-,-,-,-,-,-,-,-,-,1,-
181,Popálení a opaření (nikoliv při požáru),122,9,32,3,12,8,5,11,6,12,24,-
182,Mechanické zadušení,7,4,-,-,-,-,-,1,-,1,1,-
183,Utopení,58,-,21,10,10,1,3,3,4,2,4,-
184,Poranění střelnými zbraněmi,15,-,-,1,3,3,5,3,-,-,-,-
185,Poranění nástroji řeznými a bodnými,2,-,-,1,-,-,-,-,1,-,-,-
186a,"Poranění pádem, rozdrcením, sřícením: pádem s výše",18,-,1,-,1,1,1,1,4,6,3,-
186b,"Poranění pádem, rozdrcením, sřícením: rozdrcením",2,-,-,-,-,-,-,-,2,-,-,-
186c,"Poranění pádem, rozdrcením, sřícením: upadnutím, uklouznutím",29,-,1,1,-,1,-,4,4,5,13,-
187,Poranění při živelných pohromách,-,-,-,-,-,-,-,-,-,-,-,-
188,Poranění způsobená zvířaty,1,-,-,-,-,-,1,-,-,-,-,-
189,"Vyhladovění, žízeň",-,-,-,-,-,-,-,-,-,-,-,-
190,Neobvyklá zima,4,-,-,-,-,-,-,1,1,1,1,-
191,Neobvyklé teplo,2,-,-,-,1,-,-,-,-,1,-,-
192,Poranění bleskem,12,-,-,1,1,1,4,-,3,2,-,-
193,Úrazy způsobené elektrickým proudem,6,-,2,-,-,-,3,-,1,-,-,-
194,Úrazy způsobené jedovatými zvířaty,-,-,-,-,-,-,-,-,-,-,-,-
195,Jiné úrazy nebo zevní příčiny,165,-,7,7,11,6,14,20,33,30,37,-
196,Úmrtí vojenských osob při válečných akcích,-,-,-,-,-,-,-,-,-,-,-,-
197,Úmrtí civilních osob při válečných akcích,620,9,24,61,130,87,105,91,55,37,20,1
198a,Soudní poprava,94,-,-,-,7,18,33,28,5,1,-,2
198b,Smrt ve vězení a následky vězení,-,-,-,-,-,-,-,-,-,-,-,-
,,,,,,,,,,,,,
XVIII,Neurčité příčiny smrti,243,6,6,8,7,9,12,26,83,49,37,-
199,Náhlá smrt,13,-,1,-,-,-,1,-,6,2,3,-
200a,"Blíže neoznačené nebo nedostatečně určené příčiny: mrtvice, srdeční slabost, ochrnutí srdce bez jakéhokoliv vysvětlujícího údaje",125,1,1,2,6,2,7,17,36,33,20,-
200b,Blíže neoznačené nebo nedostatečně určené příčiny: ostatní nedostatečně udané příčiny,104,5,4,6,1,6,4,9,41,14,14,-
200c,"Blíže neoznačené nebo nedostatečně určené příčiny: nalezené mrtvoly, u nichž je příčina smrti neznáma",1,-,-,-,-,1,-,-,-,-,-,-