1944,Zemřelé ženy podle podrobného seznamu příčin smrti a věku,,,,,,,,,,,,
MKN (1938),Název,Celkem,0,1-4,5-14,15-24,25-34,35-44,45-54,55-64,65-74,75 a více,Nezjiš- těno
,,,,,,,,,,,,,
,CELKEM ZEMŘELÝCH ŽEN,49197,6327,1024,823,1828,1855,2804,3891,6309,10655,13676,5
,,,,,,,,,,,,,
I,Nemoci nakažlivé a cizopasné,6230,438,382,325,969,803,871,742,748,673,279,-
1,Tyf břišní,91,1,4,7,25,12,15,14,9,3,1,-
2,Paratyf,8,-,1,-,-,1,3,2,1,-,-,-
3,Mor,-,-,-,-,-,-,-,-,-,-,-,-
4,Cholera,1,-,-,-,-,-,-,-,-,-,1,-
5,Horečka vlnivá,-,-,-,-,-,-,-,-,-,-,-,-
6,Epidemický zánět plen mozkových a míšních,37,9,7,6,3,-,4,3,2,-,3,-
7,Uhlák,1,-,-,-,-,-,-,-,-,-,1,-
8,Spála,120,4,65,39,9,2,1,-,-,-,-,-
9,Kašel zádušný,86,69,15,2,-,-,-,-,-,-,-,-
10,Záškrt,355,47,149,84,38,12,9,6,6,4,-,-
11,Růže,128,35,2,2,2,5,6,22,1,21,32,-
12,Ztrnutí (tetanus),61,14,1,6,2,3,4,9,12,4,6,-
13,Tuberkulosa ústrojí dýchacího,3993,31,40,82,777,692,720,532,540,454,125,-
14a,Tuberkulosa plen a ústřední soustavy nervové: plen mozkových,196,20,52,58,31,12,9,4,7,2,1,-
14b,Tuberkulosa plen a ústřední soustavy nervové: jiných míst,4,-,1,-,1,-,-,-,1,-,1,-
15a,Tuberkulosa střev a pobřišnice: střev,14,-,1,-,2,4,-,2,2,2,1,-
15b,Tuberkulosa střev a pobřišnice: jiných míst,42,-,1,3,13,2,7,5,6,5,-,-
16,Tuberkulosa páteře,72,-,1,3,5,3,5,13,22,17,3,-
17,Tuberkulosa kostí a kloubů (vyjma páteře),113,-,1,1,5,2,6,12,20,39,27,-
18,Tuberkulosa kůže a podkožního vaziva,15,-,-,-,-,-,1,3,3,5,3,-
19,Tuberkulosa soustavy mízní,13,-,2,-,3,1,-,2,-,3,2,-
20,Tuberkulosa ústrojí močového a pohlavního,10,-,-,-,2,1,4,2,1,-,-,-
21a,Addisonova nemoc tuberkulosního původu,1,-,-,-,-,1,-,-,-,-,-,-
21b,Addisonova nemoc tuberkulosního původu ostatních orgánů,4,-,-,-,-,1,1,1,-,1,-,-
22,Tuberkulosa miliární,50,4,7,5,20,2,1,3,5,3,-,-
24a,Otrava krve,184,89,1,4,6,10,16,15,18,17,8,-
24b,Sněť plynová,-,-,-,-,-,-,-,-,-,-,-,-
25,Kapavka,-,-,-,-,-,-,-,-,-,-,-,-
26,Jiné nemoci způsobené mikroby (vyjma úplavici),1,-,-,-,-,-,-,-,1,-,-,-
27,Úplavice,13,1,-,1,1,2,1,1,-,3,3,-
28,Střídavka (malarie),-,-,-,-,-,-,-,-,-,-,-,-
29,Jiné nemoci způsobené prvoky cizopasnými (vyjma spirochaetami),-,-,-,-,-,-,-,-,-,-,-,-
30a,Příjice: úbyt míchy (tabes dorsalis),48,-,-,-,1,-,4,13,14,13,3,-
30b,Příjice: postupná obrna povšechná (progresivní paralysa),56,-,-,-,1,5,21,22,3,2,2,-
30c,Příjice: výduť srdečnice (aneurysma aorty),72,-,-,-,1,1,4,9,25,20,12,-
30d,Příjice: příjice vrozená,21,16,3,1,1,-,-,-,-,-,-,-
30,Příjice: jiné druhy příjice,81,-,-,1,3,5,7,29,26,8,2,-
31,Tyf zvratný,-,-,-,-,-,-,-,-,-,-,-,-
32a,Infekční žloutenka,-,-,-,-,-,-,-,-,-,-,-,-
32b,Ostatní nemoci způsobené spirochaetami,1,-,1,-,-,-,-,-,-,-,-,-
33a,Chřipka neboli influenza s onemocněním dýchydel,113,47,8,2,2,2,2,3,5,22,20,-
33b,Chřipka neboli influenza bez údaje takového onemocnění,75,31,2,3,-,1,2,1,7,11,17,-
34,Neštovice,1,-,-,-,-,1,-,-,-,-,-,-
35,Spalničky,34,16,12,5,1,-,-,-,-,-,-,-
36,Prudký zánět šedé hmoty míšní nebo mozkové,29,-,4,8,7,9,1,-,-,-,-,-
37a,Zánět mozku epidemický (lethargický): prudký,-,-,-,-,-,-,-,-,-,-,-,-
37b,Zánět mozku epidemický (lethargický): následky epidemického zánětu mozku,28,-,-,-,1,2,7,5,4,5,4,-
37c,Zánět mozku epidemický (lethargický): zánět mozku epidemický bez bližšího označení,10,2,1,2,-,-,4,1,-,-,-,-
38a,Jiné nemoci připisované virům: žlutá zimnice,-,-,-,-,-,-,-,-,-,-,-,-
38b,Jiné nemoci připisované virům: vzteklina,-,-,-,-,-,-,-,-,-,-,-,-
38c,Jiné nemoci připisované virům: plané neštovice (varicella),1,1,-,-,-,-,-,-,-,-,-,-
38d,Jiné nemoci připisované virům: ostatní nemoci připisované virům,-,-,-,-,-,-,-,-,-,-,-,-
39a,Skvrnivka (tyf exanthem.),-,-,-,-,-,-,-,-,-,-,-,-
39b,Jiné rickettsiosy,-,-,-,-,-,-,-,-,-,-,-,-
40,Ankylostomiasis,1,-,-,-,-,-,-,1,-,-,-,-
41,Boubel měchožilová (echinococcus),-,-,-,-,-,-,-,-,-,-,-,-
42,Jiné nemoci způsobené hlísty,-,-,-,-,-,-,-,-,-,-,-,-
43a,Actinomykosy,2,-,-,-,-,-,2,-,-,-,-,-
43b,Jiné mykosy,1,1,-,-,-,-,-,-,-,-,-,-
44a,nemoci pohlavní vyjma příjici a kapavku,-,-,-,-,-,-,-,-,-,-,-,-
44b,Lymphogranulomatosy,43,-,-,-,6,9,4,7,7,9,1,-
44c,Epidemický zánět příušnic,-,-,-,-,-,-,-,-,-,-,-,-
44d,Ostatní nemoci přenosné,-,-,-,-,-,-,-,-,-,-,-,-
,,,,,,,,,,,,,
II,Rakovina a jiné nádory,6115,8,15,13,49,124,491,1028,1555,1832,1000,-
45a,Rakovina a jiné zhoubné nádory dutiny ústní a hltanu: rtů,5,-,-,-,-,-,-,-,-,-,5,-
45b,Rakovina a jiné zhoubné nádory dutiny ústní a hltanu: jazyka,13,-,-,-,-,-,-,5,4,3,1,-
45c,Rakovina a jiné zhoubné nádory dutiny ústní a hltanu: jiných a blíže neoznačených míst,27,-,-,-,-,1,1,4,9,10,2,-
46a,Rakovina a jiné zhoubné nádory: jícnu,92,-,-,-,-,-,4,10,30,27,21,-
46b,Rakovina a jiné zhoubné nádory: žaludku a dvanáctníku,1638,2,-,-,5,9,40,170,414,646,352,-
46c,"Rakovina a jiné zhoubné nádory: střev, vyjma dvanáctníku a konečníku",380,-,-,-,-,6,18,52,80,144,80,-
46d,Rakovina a jiné zhoubné nádory: konečníku,225,-,-,-,-,6,19,40,50,71,39,-
46,Rakovina a jiné zhoubné nádory: jater (pokud jsou označeny jako původní) a žlučovodů,621,-,-,-,2,2,19,81,180,223,114,-
46f,"Rakovina a jiné zhoubné nádory: jater, pokud nejsou označeny  jako  původní",167,1,1,-,5,4,19,18,45,49,25,-
46g,Rakovina a jiné zhoubné nádory: slinivky břišní,52,-,-,-,-,1,5,9,20,12,5,-
46h,Rakovina a jiné zhoubné nádory: pobřišnice,99,-,-,-,-,5,3,20,35,30,6,-
46i,Rakovina a jiné zhoubné nádory: jiných a blíže neoznačených ústrojů zažívacích,2,-,-,-,-,-,1,-,-,-,1,-
47a,Rakovina a jiné zhoubné nádory: hrtanu a průdušnice,28,1,-,-,1,1,2,3,7,8,5,-
47b,"Rakovina a jiné zhoubné nádory: průdušek, plic a pohrudnice",162,-,1,1,4,5,17,26,44,57,7,-
47c,Rakovina a jiné zhoubné nádory: dýchacích ústrojů blíže neoznačených,-,-,-,-,-,-,-,-,-,-,-,-
48a,Rakovina a jiné zhoubné nádory: hrdla děložního,104,-,-,-,-,7,19,28,36,10,4,-
48b,Rakovina a jiné zhoubné nádory: dělohy,981,-,-,-,-,24,140,250,270,201,96,-
49,Rakovina a jiné zhoubné nádory: ostatních pohlavních ústrojů ženských,221,-,-,-,1,3,30,58,58,46,25,-
50,Rakovina a jiné zhoubné nádory: prsů,460,-,-,-,-,10,68,107,116,107,52,-
51a,Rakovina a jiné zhoubné nádory: šourku,x,x,x,x,x,x,x,x,x,x,x,x
51b,Rakovina a jiné zhoubné nádory: předstojné žlázy,x,x,x,x,x,x,x,x,x,x,x,x
51c,Rakovina a jiné zhoubné nádory: ostatních pohlavních ústrojů mužských,x,x,x,x,x,x,x,x,x,x,x,x
52,Rakovina a jiné zhoubné nádory: ústrojí močového,83,-,1,-,-,2,7,8,23,29,13,-
53,Rakovina a jiné zhoubné nádory: kůže,111,-,-,-,-,-,1,9,12,25,64,-
54,Rakovina a jiné zhoubné nádory: mozku a jiných částí ústrojí nervového,25,-,-,1,2,1,6,7,1,6,1,-
55a,Rakovina a jiné zhoubné nádory: nadledvinek,14,-,-,-,-,-,2,5,4,3,-,-
55b,Rakovina a jiné zhoubné nádory: kostí,82,1,1,1,8,6,10,17,12,16,10,-
55c,Rakovina a jiné zhoubné nádory: žlázy štítné,47,-,-,-,-,1,3,9,19,11,4,-
55d,Rakovina a jiné zhoubné nádory: jiných a blíže neoznačených ústrojů,156,-,2,1,5,9,12,19,35,39,34,-
55,"Carcinomatosy, sarkomatosy",20,-,-,-,-,-,1,5,6,6,2,-
55f,Metastasy bez udání prvotního místa,4,-,-,-,-,-,-,2,1,-,1,-
56a,Nádory nezhoubné: vaječníku,35,-,-,-,2,5,7,11,2,5,3,-
56b,Nádory nezhoubné: dělohy,31,-,-,-,-,2,10,12,2,3,2,-
56c,Nádory nezhoubné: jiných pohlavních ústrojů ženských,3,-,-,-,-,-,-,1,-,1,1,-
56d,Nádory nezhoubné: mozku a jiných částí ústrojí nervového,8,-,-,-,2,3,1,2,-,-,-,-
56,Nádory nezhoubné: jiných a blíže neoznačených ústrojů,6,-,1,-,1,-,-,1,1,1,1,-
57a,"Nádory, jejichž zhoubný ráz není rozlišen: vaječníku",5,-,-,1,2,1,-,-,1,-,-,-
57b,"Nádory, jejichž zhoubný ráz není rozlišen: dělohy",36,-,1,-,-,-,4,4,6,11,10,-
57c,"Nádory, jejichž zhoubný ráz není rozlišen: jiných pohlavních ústrojů ženských",1,-,-,-,1,-,-,-,-,-,-,-
57d,"Nádory, jejichž zhoubný ráz není rozlišen: mozku a jiných částí ústrojí nervového",101,1,6,5,8,10,20,23,14,9,5,-
57,"Nádory, jejichž zhoubný ráz není rozlišen: jiných a blíže neoznačených ústrojů",70,2,1,3,-,-,2,12,18,23,9,-
,,,,,,,,,,,,,
III,"Nemoci rheumatické, výživové, žláz s vnitřním vyměšováním, jiné nemoci celkové a avitaminos",838,34,16,53,40,19,45,91,187,236,117,-
58a,Horečný rheumatismus kloubový prudký: prudké rheumatické choroby srdce,67,-,6,43,7,2,3,3,2,1,-,-
58b,Horečný rheumatismus kloubový prudký: jiné formy,11,-,-,1,4,-,2,-,-,2,2,-
59,Rheumatismus vleklý a jiné formy nemoci rheumatické,132,-,-,1,1,3,2,8,24,41,52,-
60,Dna,1,-,-,-,-,-,-,-,-,1,-,-
61,Úplavice cukrová,461,-,1,5,21,9,17,54,136,162,56,-
62,Nemoci podvěsku mozkového,1,-,-,-,-,-,-,-,1,-,-,-
63a,Nemoci žlázy štítné a žlázek přídatných: vole prosté,18,1,-,-,1,-,6,-,3,3,4,-
63b,Nemoci žlázy štítné a žlázek přídatných: nemoc Basedowova,81,-,-,-,3,4,6,21,20,24,3,-
63c,Nemoci žlázy štítné a žlázek přídatných: jiné nemoci žlázy štítné,6,-,-,2,1,-,1,1,1,-,-,-
63d,Nemoci žlázy štítné a žlázek přídatných: nemoci žlázek příštítných,-,-,-,-,-,-,-,-,-,-,-,-
64,Nemoci brzlíku,22,16,6,-,-,-,-,-,-,-,-,-
65a,"Nemoci nadledvinek, neoznačené za tuberkulosní: nemoc Addisonova (neoznačená za tuberkulosní)",12,-,-,-,-,1,7,2,-,2,-,-
65b,"Nemoci nadledvinek, neoznačené za tuberkulosní: jiné nemoci nadledvinek",1,-,-,-,1,-,-,-,-,-,-,-
66a,Jiné nemoci celkové: měknutí kostí,2,1,1,-,-,-,-,-,-,-,-,-
66b,Jiné nemoci celkové: ostatní nemoci celkové,1,1,-,-,-,-,-,-,-,-,-,-
67,Kurděje,1,-,-,-,-,-,-,1,-,-,-,-
68,Beri-beri,-,-,-,-,-,-,-,-,-,-,-,-
69,Pellagra,-,-,-,-,-,-,-,-,-,-,-,-
70,Křivice,19,13,2,1,1,-,1,1,-,-,-,-
71,Jiné avitaminosy,2,2,-,-,-,-,-,-,-,-,-,-
,,,,,,,,,,,,,
IV,Nemoci krve a ústrojů krvetvorných,265,10,4,10,23,16,30,37,55,57,23,-
72a,Stavy krvácivé: purpury prvotní,9,2,-,-,-,-,2,2,2,1,-,-
72b,Stavy krvácivé: nemoci krve (haemophilie),1,-,-,-,1,-,-,-,-,-,-,-
73a,Chudokrevnost: zhoubná chudokrevnost,92,-,-,-,3,2,4,11,22,35,15,-
73b,Chudokrevnost: jiná anaemie,38,3,1,1,4,3,5,4,3,8,6,-
74a,Leukaemie a aleukaemie: bělokrevnost pravá,107,4,2,7,13,11,16,17,23,12,2,-
74b,Leukaemie a aleukaemie: aleukaemie,4,-,-,1,1,-,1,-,1,-,-,-
75,Nemoci sleziny,6,-,1,-,-,-,1,1,2,1,-,-
76a,Jiné nemoci krve a ústrojů krvetvorných: agranulocytosy,6,-,-,1,1,-,1,1,2,-,-,-
76b,Jiné nemoci krve a ústrojů krvetvorných: ostatní nemoci krve a ústrojů krvetvorných,2,1,-,-,-,-,-,1,-,-,-,-
,,,,,,,,,,,,,
V,Otravy vleklé,7,-,-,-,-,-,-,2,3,2,-,-
77a,Alkoholismus prudký,1,-,-,-,-,-,-,-,1,-,-,-
77b,Alkoholismus vleklý a bez bližšího označení,6,-,-,-,-,-,-,2,2,2,-,-
78a,Otrava olovem: označená jako z povolání,-,-,-,-,-,-,-,-,-,-,-,-
78b,Otrava olovem: neoznačená jako z povolání,-,-,-,-,-,-,-,-,-,-,-,-
79,Vleklé otravy jinými látkami neústrojnými a ústrojnými,-,-,-,-,-,-,-,-,-,-,-,-
,,,,,,,,,,,,,
DU,,65,0,0,3,4,4,7,14,20,10,3,0
,,,,,,,,,,,,,
VI,Nemoci soustavy nervové a smyslových ústrojů,3989,404,70,55,60,68,144,315,660,1084,1129,-
80a,Zánět mozku (nikoli epidemický): hlíza mozková,7,-,-,-,2,-,2,-,2,1,-,-
80b,Zánět mozku (nikoli epidemický): jiné formy,49,9,6,8,6,4,7,4,2,3,-,-
81,Zánět plen mozkových prostý,151,45,32,17,13,8,11,7,9,6,3,-
82,Nemoci míchy,66,2,-,1,5,4,9,16,13,16,-,-
83a,Krvácení mozkové a ostatní poruchy mozkové původu cévního: krvácení mozkové,2591,-,-,1,5,11,42,202,507,901,922,-
83b,Krvácení mozkové a ostatní poruchy mozkové původu cévního: vmetek a záhať mozková,57,-,-,-,3,1,2,6,17,9,19,-
83c,Krvácení mozkové a ostatní poruchy mozkové původu cévního: měknutí mozku,87,-,-,-,-,-,-,1,11,27,48,-
83d,Krvácení mozkové a ostatní poruchy mozkové původu cévního: jedostranná obrna těla a jiné obrny blíže neoznačené,192,-,-,-,1,5,6,13,34,53,80,-
84a,Duševní nemoci a vady: slabomyslnost,9,-,-,3,1,1,-,2,2,-,-,-
84b,Duševní nemoci a vady: schoizophrenie,12,-,-,-,1,1,2,3,-,3,2,-
84c,Duševní nemoci a vady: manio-depresivní psychosy,5,-,-,-,-,-,1,-,1,2,1,-
84d,Duševní nemoci a vady: jiné duševní poruchy,32,-,-,-,2,2,4,7,14,3,-,-
85,Padoucnice,63,-,-,8,6,11,13,11,2,11,1,-
86,Křeče u dětí do 5 let,312,290,22,-,-,-,-,-,-,-,-,-
87a,Jiné nemoci soustavy nervové: chorea,1,-,-,-,-,-,-,-,-,1,-,-
87b,Jiné nemoci soustavy nervové: neuritis původu nikoli rheumatického,13,-,-,-,-,-,2,3,2,2,4,-
87c,Jiné nemoci soustavy nervové: obrna třesavá,33,-,-,-,-,-,-,4,9,10,10,-
87d,Jiné nemoci soustavy nervové: sklerosa roztroušená,157,-,-,-,3,12,33,25,22,30,32,-
87,Jiné nemoci soustavy nervové: ostatní nemoci soustavy nervové,32,-,-,7,6,3,3,5,5,1,2,-
88,Nemoci ústrojí zrakového,-,-,-,-,-,-,-,-,-,-,-,-
89a,Nemoci ucha a dutiny výčnělku soscovitého: zánět ušní,117,56,10,10,6,5,7,6,8,5,4,-
89b,Nemoci ucha a dutiny výčnělku soscovitého: jiné nemoci ucha,3,2,-,-,-,-,-,-,-,-,1,-
,,,,,,,,,,,,,
VII,Nemoci ústrojí oběhu krevního,13078,34,28,81,151,198,458,733,1772,4179,5444,-
90a,Zánět osrdečníku: rheumatický zánět osrdečníku vleklý,1,-,-,1,-,-,-,-,-,-,-,-
90b,Zánět osrdečníku: jiné nemoci osrdečníku,9,-,-,1,1,1,1,-,1,3,1,-
91,Prudký zánět nitroblány srdeční a chlopní (nikoli rheumatický),37,2,4,15,9,2,4,1,-,-,-,-
92a,Vleklé onemocnění nitroblány srdeční a chlopní: označené jako rheumatické,1145,-,4,26,48,69,122,131,199,313,233,-
92b,Vleklé onemocnění nitroblány srdeční a chlopní: neoznačené jako rheumatické,99,-,-,3,10,9,11,21,21,19,5,-
93a,Nemoci svalu srdečního: prudký zánět svalu srdečního (nikoli rheumatický),51,1,4,2,1,3,7,7,5,10,11,-
93b,Nemoci svalu srdečního: vleklý zánět svalu srdečního označený jako rheumatický,200,-,-,-,1,-,7,16,38,76,62,-
93c,"Nemoci svalu srdečního: degenerace a infarkt srdeční, sklerosa svalu srdečního nebo jeho vleklý zánět neoznačený jako rheumatický",6357,11,6,3,20,37,121,266,803,2129,2961,-
93d,Nemoci svalu srdečního: zánět svalu srdečního nerozlišený,1397,6,5,5,8,18,28,60,190,463,614,-
94a,Nemoci tepen věnčitých,54,-,-,-,-,1,1,5,12,20,15,-
94b,Angina srdeční,117,-,-,-,-,-,2,13,31,45,26,-
95a,Jiné nemoci srdce: označené jako rheumatické,73,-,-,3,3,-,3,11,13,29,11,-
95b,Jiné nemoci srdce: ostatní nemoci srdce,1953,12,4,21,43,53,122,169,342,665,522,-
96,"Výduť, vyjma výduť srdeční a aneurysma aorty",8,-,-,-,1,-,2,2,-,1,2,-
97,Zkornatění tepen,1384,-,-,-,-,1,6,19,94,359,905,-
98,Sněť,75,1,-,1,1,-,1,2,5,17,47,-
99,Jiné nemoci tepen,37,-,-,-,-,3,6,3,1,12,12,-
100a,Nemoci žil: městky,28,-,-,-,-,-,4,2,3,5,14,-
100b,Nemoci žil: jiné nemoci žil,37,-,-,-,2,1,8,4,11,10,1,-
101,Nemoci soustavy mízní,8,1,-,-,2,-,-,-,2,1,2,-
102,Essentielní zvýšení tlaku krevního,5,-,-,-,-,-,1,1,1,2,-,-
103,Jiné nemoci ústrojí oběhu krevního,3,-,1,-,1,-,1,-,-,-,-,-
,,,,,,,,,,,,,
VIII,Nemoci ústrojů dýchacích,5739,1906,294,53,58,72,131,217,467,1094,1447,-
104,Nemoci dutiny nosní a přídatných útvarů,1,1,-,-,-,-,-,-,-,-,-,-
105,Nemoci hrtanu,7,4,1,-,1,-,-,1,-,-,-,-
106a,Zánět průdušek: prudký,103,66,5,-,-,-,-,3,2,8,19,-
106b,Zánět průdušek: vleklý,178,6,2,1,1,2,7,4,17,59,79,-
106c,Zánět průdušek: blíže neoznačený,221,83,10,1,-,-,1,7,11,31,77,-
107,Lalůčkový zánět plic (bronchopneumonie),2791,1358,167,20,14,19,44,58,145,357,609,-
108,Lalokový zánět plic,919,121,43,16,19,20,34,69,131,259,207,-
109,Zánět plic blíže neoznačený,839,244,45,5,9,13,22,33,65,189,214,-
110a,Zánět pohrudnice: empyema thoracis,68,13,13,2,4,4,7,6,11,4,4,-
110b,Zánět pohrudnice: jiné formy zánětu pohrudnice,135,9,6,5,3,7,4,12,19,39,31,-
111a,"Infarkt s krvácením, embolie a trombosa plic",44,-,-,1,1,3,3,10,15,4,7,-
111b,Hypostatický zánět a oedem plic,43,1,1,1,1,-,3,3,6,10,17,-
112,Záducha (asthma),112,-,-,-,-,1,2,4,14,47,44,-
113,Rozedma plic,237,-,1,1,1,1,-,2,20,77,134,-
114a,Jiné nemoci ústrojí dýchacího: prašnost plic a jiné onemocnění ústrojí dýchacího z povolání,1,-,-,-,-,-,-,-,-,1,-,-
114b,Jiné nemoci ústrojí dýchacího: sněť a hlíza plic,35,-,-,-,3,2,4,4,9,8,5,-
114c,Jiné nemoci ústrojí dýchacího: ostatní nemoci ústrojí dýchacího neoznačené jako z povolání,5,-,-,-,1,-,-,1,2,1,-,-
,,,,,,,,,,,,,
IX,Nemoci ústrojí zažívacího,2797,1232,78,81,72,92,135,229,309,339,230,-
115a,Nemoci mandlí a hltanu,72,19,5,6,5,7,6,6,12,2,4,-
115b,Jiné nemoci dutiny ústní a jejích ústrojů,9,4,-,-,-,2,-,-,1,1,1,-
116,Nemoci jícnu,2,-,-,1,1,-,-,-,-,-,-,-
117a,Vřed žaludeční,118,-,-,-,1,5,8,28,30,36,10,-
117b,Vřed dvanáctníkový,26,-,-,-,1,3,1,11,6,3,1,-
118,Jiné nemoci žaludku,22,-,-,-,-,-,2,3,4,5,8,-
119,Průjem a katar střevní u dětí do 2 let,1227,1182,45,-,-,-,-,-,-,-,-,-
120a,Průjem katar a vředy střevní (ve věku 2 let a výše): průjem a katar střevní,89,-,6,12,4,2,3,6,12,20,24,-
120b,Průjem katar a vředy střevní (ve věku 2 let a výše): vředy střevní (vyjma vředy dvanáctníku),5,-,-,-,-,-,1,-,1,2,1,-
121,Zánět červíkovitého přívěsku,146,2,10,25,27,13,13,18,20,13,5,-
122a,Kýla,116,2,-,-,-,2,1,9,26,47,29,-
122b,Neprůchodnost střevní,211,8,1,6,8,12,17,21,39,46,53,-
123,Ostatní nemoci střevní,9,-,-,1,-,-,2,-,1,1,4,-
124a,Svraštění jater: alkoholické,-,-,-,-,-,-,-,-,-,-,-,-
124b,Svraštění jater: neoznačené za alkoholické,251,-,1,1,3,7,17,46,68,71,37,-
125a,Jiné nemoci jater: žlutá atrofie jater prudká (kromě případů z těhotenství a stavu poporodního),67,-,-,4,8,9,13,12,7,11,3,-
125b,Jiné nemoci jater: ostatní nemoci jater,41,-,1,2,1,2,6,4,9,9,7,-
126,Kaménky žlučové,101,-,-,-,2,3,8,19,26,25,18,-
127,Jiné nemoci žlučníku a žlučovodů,99,1,-,-,-,6,6,16,23,32,15,-
128,Nemoci slinivky břišní,13,-,-,-,-,1,2,4,4,1,1,-
129,Zánět pobřišnice bez udání příčiny,173,14,9,23,11,18,29,26,20,14,9,-
,,,,,,,,,,,,,
X,Nemoci ústrojí močového a pohlavního,1065,18,11,16,44,47,101,166,226,277,159,-
130,Prudký zánět ledvin,43,3,1,5,3,4,6,2,11,7,1,-
131,Vleklý zánět ledvin,737,-,6,8,16,18,54,123,176,218,118,-
132,Zánět ledvin nerozlišený,79,1,2,2,9,3,7,8,11,26,10,-
133a,"Jiné nemoci ledvin, pánvičky ledvinné a močovodů: pyelitis, pyelonephritis, pyelocystitis",60,12,1,-,5,5,6,5,6,11,9,-
133b,"Jiné nemoci ledvin, pánvičky ledvinné a močovodů: ostatní onemocnění těchto ústrojí",14,-,-,-,1,-,3,1,3,1,5,-
134,Kaménky cest močových,24,-,1,-,-,-,6,6,4,6,1,-
135a,Zánět měchýře močového,11,1,-,1,-,-,1,2,2,1,3,-
135b,Jiné nemoci močového měchýře a poruchy močení,4,1,-,-,-,-,-,-,-,-,3,-
136,Nemoci roury močové,12,-,-,-,1,1,1,-,3,3,3,-
137a,Nezhoubné nádory žlázy předstojné,x,x,x,x,x,x,x,x,x,x,x,x
137b,Zbytnění žlázy předstojné,x,x,x,x,x,x,x,x,x,x,x,x
137c,Ostatní nemoci žlázy předstojné,x,x,x,x,x,x,x,x,x,x,x,x
138,Nemoci pohlavních ústrojů mužských neoznačené za venerické,x,x,x,x,x,x,x,x,x,x,x,x
139a,"Nemoci pohlavních ústrojů ženských neoznačené za venerické (kromě případů z těhotenství a puerperia): nemoci vaječníku, vejcovodu a parametria",54,-,-,-,7,13,10,15,7,1,1,-
139b,Nemoci pohlavních ústrojů ženských neoznačené za venerické (kromě případů z těhotenství a puerperia): dělohy,22,-,-,-,1,1,6,4,3,2,5,-
139c,Nemoci pohlavních ústrojů ženských neoznačené za venerické (kromě případů z těhotenství a puerperia): prsů,3,-,-,-,1,1,1,-,-,-,-,-
139d,Nemoci pohlavních ústrojů ženských neoznačené za venerické (kromě případů z těhotenství a puerperia): jiné nemoci ženských ústrojů pohlavních,2,-,-,-,-,1,-,-,-,1,-,-
,,,,,,,,,,,,,
XI,"Nemoci těhotenství, porodu a stavu poporodního",311,-,-,-,68,159,83,1,-,-,-,-
140,Potrat se sepsí,52,-,-,-,15,25,12,-,-,-,-,-
141,Potrat bez zmínky o sepsi,6,-,-,-,-,5,1,-,-,-,-,-
142,Těhotenství mimoděložní,20,-,-,-,1,12,7,-,-,-,-,-
143a,Krvácení v těhotenství: lůžko vcestné,1,-,-,-,-,1,-,-,-,-,-,-
143b,Krvácení v těhotenství: krvácení předčasným odloučením lůžka a jiná krvácení krátce před porodem (nikoliv při potratu),-,-,-,-,-,-,-,-,-,-,-,-
143c,Krvácení v těhotenství: jiná a blíže neoznačená krvácení v těhotenství,1,-,-,-,-,-,1,-,-,-,-,-
144a,Otrava krve v těhotenství: křeče v těhotenství,8,-,-,-,1,6,1,-,-,-,-,-
144b,Otrava krve v těhotenství: albuminutrie a zánět ledvin v těhotenství,7,-,-,-,2,3,2,-,-,-,-,-
144c,Otrava krve v těhotenství: jiné toxikosy,-,-,-,-,-,-,-,-,-,-,-,-
145,Jiné nemoci a příhody těhotenství,2,-,-,-,-,2,-,-,-,-,-,-
146a,Krvácení při porodu a poporodní: lůžko vcestné při porodu,22,-,-,-,1,11,9,1,-,-,-,-
146b,Krvácení při porodu a poporodní: krvácení předčasným odloučením lůžka při porodu,-,-,-,-,-,-,-,-,-,-,-,-
146c,Krvácení při porodu a poporodní: jiné krvácení při porodu,3,-,-,-,-,2,1,-,-,-,-,-
146d,Krvácení při porodu a poporodní: krvácení po porodu,26,-,-,-,9,10,7,-,-,-,-,-
147a,Otrava krve při porodu a při stavu poporodním: horečka omladnic a ztrnutí poporodní (všeobecná  a místní infekce),90,-,-,-,23,47,20,-,-,-,-,-
147b,Otrava krve při porodu a při stavu poporodním: thrombophlebitis puerperalis,2,-,-,-,-,2,-,-,-,-,-,-
147c,Otrava krve při porodu a při stavu poporodním: embolie a náhlá smrt puerperální,4,-,-,-,1,3,-,-,-,-,-,-
148a,Toxikosy ve stavu poporodním: eclampsie,23,-,-,-,6,13,4,-,-,-,-,-
148b,Toxikosy ve stavu poporodním: albuminurie a zánět ledvin,2,-,-,-,-,1,1,-,-,-,-,-
148c,Toxikosy ve stavu poporodním: jiné toxikosy,-,-,-,-,-,-,-,-,-,-,-,-
149a,Jiné příhody porodu: ruptura a jiné poranění porodních ústrojí při porodu (bez krvácení),21,-,-,-,2,8,11,-,-,-,-,-
149b,Jiné příhody porodu: ostatní příhody,11,-,-,-,1,7,3,-,-,-,-,-
150,Jiné a blíže neoznačené nemoci porodu a stavu poporodního,10,-,-,-,6,1,3,-,-,-,-,-
,,,,,,,,,,,,,
XII,Nemoci kůže a vaziva podkožního,197,150,3,1,2,-,5,9,3,11,13,-
151,Nežitina (furunculosis),111,95,2,-,-,-,1,4,2,3,4,-
152,Zánět podkožního vaziva,39,15,-,1,1,-,3,3,1,7,8,-
153,Jiné nemoci kůže a vaziva podkožního,47,40,1,-,1,-,1,2,-,1,1,-
,,,,,,,,,,,,,
XIII,Nemoci kostí a ústrojí pohybu,174,7,3,8,7,6,3,7,18,32,83,-
154,Zánět dřeně kostní a okostice,45,6,3,3,3,2,-,4,6,10,8,-
155,Jiné nemoci kostí,99,1,-,1,1,1,1,1,8,16,69,-
156a,Nemoci kloubů a ostatních orgánů pohybu: kloubů,14,-,-,2,1,-,-,2,2,4,3,-
156b,Nemoci kloubů a ostatních orgánů pohybu: ostatních orgánů pohybu,16,-,-,2,2,3,2,-,2,2,3,-
,,,,,,,,,,,,,
XIV,Vrozené vady vývojové,253,241,4,6,2,-,-,-,-,-,-,-
157a,Vrozené vady vývojové: vrozená vodnatelnost mozku,28,27,1,-,-,-,-,-,-,-,-,-
157b,Vrozené vady vývojové: rozštěp páteře a kýla omozečnicová,36,36,-,-,-,-,-,-,-,-,-,-
157c,Vrozené vady vývojové: vrozené anomalie tvaru srdce,132,122,2,6,2,-,-,-,-,-,-,-
157d,Vrozené vady vývojové: zrůdy,5,5,-,-,-,-,-,-,-,-,-,-
157,Vrozené vady vývojové: vrozené zúžení vrátníku,5,5,-,-,-,-,-,-,-,-,-,-
157f,Vrozené vady vývojové: rozštěp patra,18,18,-,-,-,-,-,-,-,-,-,-
157g,Vrozené vady vývojové: zarostění řiti,2,2,-,-,-,-,-,-,-,-,-,-
157h,Vrozené vady vývojové: jiné vady vývojové,21,20,1,-,-,-,-,-,-,-,-,-
157i,Vrozené vady vývojové: bez bližšího označení,6,6,-,-,-,-,-,-,-,-,-,-
,,,,,,,,,,,,,
XV,Zvláštní nemoci útlého věku,1808,1808,-,-,-,-,-,-,-,-,-,-
158,Vrozená slabost dětí donošených,537,537,-,-,-,-,-,-,-,-,-,-
159,Předčasné narození,816,816,-,-,-,-,-,-,-,-,-,-
160,Následky porodu,162,162,-,-,-,-,-,-,-,-,-,-
161a,Jiné zvláštní nemoci útlého věku: asphyxie při nebo po porodu,160,160,-,-,-,-,-,-,-,-,-,-
161b,Jiné zvláštní nemoci útlého věku: nákazy novorozenců,84,84,-,-,-,-,-,-,-,-,-,-
161c,Jiné zvláštní nemoci útlého věku: melaena neonatorum,3,3,-,-,-,-,-,-,-,-,-,-
161d,Jiné zvláštní nemoci útlého věku: jiné nemoci novorozenců,46,46,-,-,-,-,-,-,-,-,-,-
,,,,,,,,,,,,,
XVI,Stařecká sešlost,4149,-,-,-,-,-,-,-,-,597,3550,2
162a,Stařecká sešlost u osob ve věku 65 a více let: s demencí stařeckou,104,-,-,-,-,-,-,-,-,27,77,-
162b,Stařecká sešlost u osob ve věku 65 a více let: bez údaje o stařecké demenci,4045,-,-,-,-,-,-,-,-,570,3473,2
,,,,,,,,,,,,,
XVII ,Zevní příčiny smrti,1939,31,110,113,276,242,295,288,223,193,165,3
SE,Sebevraždy,541,-,-,2,66,90,102,91,76,72,42,-
163a,Sebevražda otravou látkami žíravými,20,-,-,-,3,5,4,2,3,3,-,-
163b,Sebevražda otravou léky utišujícími a látkami omamnými,22,-,-,-,3,5,6,5,1,1,1,-
163c,Sebevražda otravou léky uspávajícími,15,-,-,-,4,2,3,5,1,-,-,-
163d,Sebevražda otravou jinými blíže neoznačenými jedy pevnými a tekutými,40,-,-,-,11,16,4,4,3,2,-,-
163,Sebevražda otravou svítiplynem,21,-,-,-,5,4,2,5,-,2,3,-
163f,Sebevražda otravou jinými a nerozlišenými jedovatými plyny,14,-,-,-,2,3,3,2,3,1,-,-
164a,Jiné sebevraždy oběšením a uškrcením,254,-,-,1,17,32,54,43,40,41,26,-
164b,Jiné sebevraždy utopením,80,-,-,-,3,10,15,15,13,13,11,-
164c,Jiné sebevraždy střelnými zbraněmi a výbušnými látkami,4,-,-,-,2,1,1,-,-,-,-,-
164d,Jiné sebevraždy nástroji řeznými a bodnými,8,-,-,-,-,1,-,1,2,4,-,-
164,Jiné sebevraždy skokem s výše,16,-,-,1,3,-,4,3,4,1,-,-
164f,Jiné sebevraždy přejetím,30,-,-,-,12,7,2,3,2,3,1,-
164g,Ostatní sebevraždy blíže neoznačené,5,-,-,-,-,-,1,1,2,1,-,-
164h,Sebevraždy bez bližšího označení,12,-,-,-,1,4,3,2,2,-,-,-
NA,Vraždy a zabití,37,9,3,2,5,6,6,2,3,-,1,-
165a,Vražda dítěte do 1 roku: zjištěná násilná smrt,9,9,-,-,-,-,-,-,-,-,-,-
165b,Vražda dítěte do 1 roku: nalezená mrtvola dítěte,-,-,-,-,-,-,-,-,-,-,-,-
166,Vražda a zabití střelnou zbraní osob ve věku 1 rok a vyšším,8,-,-,-,3,2,1,-,2,-,-,-
