1985,Zemřelí muži podle podrobného seznamu příčin smrti a věku - úrazy a otravy podle vnější příčiny,,,,,,,,,,,,,,,,,,,,,,,
MKN (1976),Název,Celkem,0,1,2,3,4,5-9,10-14,15-19,20-24,25-29,30-34,35-39,40-44,45-49,50-54,55-59,60-64,65-69,70-74,75-79,80-84,85+
,,,,,,,,,,,,,,,,,,,,,,,,
VN,Vnější příčiny poranění a otrav,5029,72,16,6,10,5,55,67,208,270,280,376,401,360,301,304,353,336,228,408,443,318,212
,,,,,,,,,,,,,,,,,,,,,,,,
D1,Úrazy na železnicích,96,-,-,-,-,-,1,-,14,11,10,6,4,9,7,5,9,6,-,5,5,3,1
E800,Srážka se železničními vozidly,-,-,-,-,-,-,-,-,-,-,-,-,-,-,-,-,-,-,-,-,-,-,-
E801,Náraz na jiný předmět,1,-,-,-,-,-,-,-,-,-,-,-,-,1,-,-,-,-,-,-,-,-,-
E802,Vykolejení bez předchozí srážky nebo nárazu,-,-,-,-,-,-,-,-,-,-,-,-,-,-,-,-,-,-,-,-,-,-,-
E803,"Výbuch, oheň nebo popálení",-,-,-,-,-,-,-,-,-,-,-,-,-,-,-,-,-,-,-,-,-,-,-
E804,Pád ve vlaku nebo z vlaku,1,-,-,-,-,-,-,-,-,1,-,-,-,-,-,-,-,-,-,-,-,-,-
E805,Zasažení železničním vozidlem,88,-,-,-,-,-,1,-,14,10,9,5,4,8,7,4,7,6,-,5,5,2,1
E806,Jiný blíže popsaný úraz  na železnici,1,-,-,-,-,-,-,-,-,-,-,-,-,-,-,1,-,-,-,-,-,-,-
E807,Železniční úraz NS,5,-,-,-,-,-,-,-,-,-,1,1,-,-,-,-,2,-,-,-,-,1,-
,,,,,,,,,,,,,,,,,,,,,,,,
D2,Provozní úrazy motorovými vozidly,730,2,1,-,4,2,23,17,57,79,47,64,56,49,36,56,49,44,34,41,42,18,9
E810,Srážka motorového vozidla s vlakem,11,-,-,-,-,-,1,-,2,-,1,1,1,-,1,-,1,-,-,3,-,-,-
E811,Srážka motorového vozidla s jiným motorovým vozidlem při návratu do jízdní dráhy,4,-,-,-,-,-,-,-,1,1,1,-,-,-,1,-,-,-,-,-,-,-,-
E812,Jiná srážka motorového vozidla s jiným motorovým vozidel,68,-,-,-,-,-,-,1,9,7,4,5,4,7,2,9,3,8,6,1,2,-,-
E813,Srážka motorového vozidla s jiným vozidlem,39,-,-,-,-,-,1,2,2,1,4,-,3,1,1,2,4,3,3,7,3,2,-
E814,Srážka motorového vozidla s chodcem,163,-,-,-,1,2,12,4,3,10,5,8,9,8,11,14,12,12,12,11,21,5,3
E815,Jiný náraz motorového vozidla na předmět na silnici,18,-,-,-,-,-,-,-,2,7,-,1,2,1,-,3,1,1,-,-,-,-,-
E816,"Ztráta vlády nad motorovým vozidlem na silnici, beze srážky",64,-,1,-,-,-,-,1,10,11,7,7,4,8,2,4,4,1,1,1,1,1,-
E817,"Úraz při nastupování nebo vystupování, bez srážky",3,-,-,-,-,-,1,-,-,-,-,-,-,1,-,1,-,-,-,-,-,-,-
E818,Jiný provozní úraz motorovým vozidlem bez srážky,8,-,-,-,-,-,-,-,-,3,1,1,-,-,-,-,-,-,-,1,-,2,-
E819,"Jiný provozní úraz motorovým vozidlem, bez srážky",352,2,-,-,3,-,8,9,28,39,24,41,33,23,18,23,24,19,12,17,15,8,6
,,,,,,,,,,,,,,,,,,,,,,,,
D3,Neprovozní úrazy motorovými vozidly,12,-,-,-,-,-,-,-,1,1,-,4,-,-,1,3,-,-,-,2,-,-,-
E820,Neprovozní úraz motorovým vozidlem pro jizdu na sněhu,1,-,-,-,-,-,-,-,-,-,-,-,-,-,-,-,-,-,-,1,-,-,-
E821,Neprovozní úraz jiným mimosilničním motorovým vozidlem ,4,-,-,-,-,-,-,-,-,-,-,1,-,-,-,2,-,-,-,1,-,-,-
E822,Neprovozní úraz jiným motorovým vozidlem při srážce s pohybujícím se předmětem,1,-,-,-,-,-,-,-,-,-,-,-,-,-,1,-,-,-,-,-,-,-,-
E823,Neprovozní úraz  jiným motorovým vozidlem při nárazu na nepohybující se předmět,1,-,-,-,-,-,-,-,-,-,-,-,-,-,-,1,-,-,-,-,-,-,-
E824,Neprovozní úraz jiným motorovým vozidlem při nastupování nebo vystupování,-,-,-,-,-,-,-,-,-,-,-,-,-,-,-,-,-,-,-,-,-,-,-
E825,Neprovozní úraz jiné nebo NS povahy jiným  motorovým vozidlem,5,-,-,-,-,-,-,-,1,1,-,3,-,-,-,-,-,-,-,-,-,-,-
,,,,,,,,,,,,,,,,,,,,,,,,
D4,Úrazy jinými silničními vozidly,43,-,-,-,-,-,-,1,-,3,3,1,6,2,3,3,3,3,2,4,6,3,-
E826,Úraz způsobený jizdním kolem,33,-,-,-,-,-,-,1,-,3,2,1,6,2,2,3,3,3,-,2,3,2,-
E827,Úraz způsobený vozidlem taženým zvířaty,-,-,-,-,-,-,-,-,-,-,-,-,-,-,-,-,-,-,-,-,-,-,-
E828,Úraz způsobený zvířetem nesousím člověka,1,-,-,-,-,-,-,-,-,-,-,-,-,-,-,-,-,-,-,-,-,1,-
E829,Úrazy způsobené jinými silničními vozidly,9,-,-,-,-,-,-,-,-,-,1,-,-,-,1,-,-,-,2,2,3,-,-
,,,,,,,,,,,,,,,,,,,,,,,,
D5,Úrazy při vodní dopravě,3,-,-,-,-,-,-,-,-,3,-,-,-,-,-,-,-,-,-,-,-,-,-
E830,"Nehoda plavidla (srážka, ztroskotání, převržení) mající za následek potopení osoby",-,-,-,-,-,-,-,-,-,-,-,-,-,-,-,-,-,-,-,-,-,-,-
E831,Jiný úraz při  nehodě plavidla,-,-,-,-,-,-,-,-,-,-,-,-,-,-,-,-,-,-,-,-,-,-,-
E832,Jiné náhodné potopení nebo (u)tonutí při vodní dopravě,3,-,-,-,-,-,-,-,-,3,-,-,-,-,-,-,-,-,-,-,-,-,-
E833,Pád na schodech nebo žebříku při vodní dopravě,-,-,-,-,-,-,-,-,-,-,-,-,-,-,-,-,-,-,-,-,-,-,-
E834,Jiný pád s jedné úrovně na jinou při vodní dopravě,-,-,-,-,-,-,-,-,-,-,-,-,-,-,-,-,-,-,-,-,-,-,-
E835,Jiný nebo NS pád při vodní dopravě,-,-,-,-,-,-,-,-,-,-,-,-,-,-,-,-,-,-,-,-,-,-,-
E836,Úraz u stroje při vodní dopravě,-,-,-,-,-,-,-,-,-,-,-,-,-,-,-,-,-,-,-,-,-,-,-
E837,"Výbuch, oheň nebo popálení na plavidle",-,-,-,-,-,-,-,-,-,-,-,-,-,-,-,-,-,-,-,-,-,-,-
E838,Jiný nebo NS úraz při vodní dopravě,-,-,-,-,-,-,-,-,-,-,-,-,-,-,-,-,-,-,-,-,-,-,-
,,,,,,,,,,,,,,,,,,,,,,,,
D6,Úrazy při dopravě vzduchem a mimovzdušným prostorem,7,-,-,-,-,-,-,-,-,2,3,2,-,-,-,-,-,-,-,-,-,-,-
E840,Nehoda motorového letadla při stratu nebo přistávání,-,-,-,-,-,-,-,-,-,-,-,-,-,-,-,-,-,-,-,-,-,-,-
E841,Jiná nebo NS nehoda motorového letadla,4,-,-,-,-,-,-,-,-,1,1,2,-,-,-,-,-,-,-,-,-,-,-
E842,Nehoda letadla bez motoru,2,-,-,-,-,-,-,-,-,-,2,-,-,-,-,-,-,-,-,-,-,-,-
E843,Pád v letadle nebo z letadla,-,-,-,-,-,-,-,-,-,-,-,-,-,-,-,-,-,-,-,-,-,-,-
E844,Jiný blíže psaný úraz při dopravě vzduchem,1,-,-,-,-,-,-,-,-,1,-,-,-,-,-,-,-,-,-,-,-,-,-
E845,Nehoda kosmické lodi,-,-,-,-,-,-,-,-,-,-,-,-,-,-,-,-,-,-,-,-,-,-,-
,,,,,,,,,,,,,,,,,,,,,,,,
D7,Úrazy způsobené vozidly a nezařaditelné jinam,1,-,-,-,-,-,-,-,-,-,-,-,-,1,-,-,-,-,-,-,-,-,-
E846,"Úrazy způsobené vozidly s motorovým pohonem, používanými jen v budovách a na pozemcích výrobního nebo obchodního závodu ",1,-,-,-,-,-,-,-,-,-,-,-,-,1,-,-,-,-,-,-,-,-,-
E847,"Úrazy způsobené lanovými vozy, nejedoucimi po kolejích ",-,-,-,-,-,-,-,-,-,-,-,-,-,-,-,-,-,-,-,-,-,-,-
E848,"Úrazy způsobené jinými vozidly, nezařaditelné jinam",-,-,-,-,-,-,-,-,-,-,-,-,-,-,-,-,-,-,-,-,-,-,-
,,,,,,,,,,,,,,,,,,,,,,,,
,"Náhodné otravy léky, chemickými látkami používanými v lékařství a biologickými látkami",2,-,-,-,-,-,-,-,-,-,-,1,-,-,-,-,-,1,-,-,-,-,-
E850,"Analgetika, antipyretika a antirevmatika",-,-,-,-,-,-,-,-,-,-,-,-,-,-,-,-,-,-,-,-,-,-,-
E851,Barbituráty,1,-,-,-,-,-,-,-,-,-,-,-,-,-,-,-,-,1,-,-,-,-,-
E852,Jiná sedativa a hypnotika,-,-,-,-,-,-,-,-,-,-,-,-,-,-,-,-,-,-,-,-,-,-,-
E853,Trankvilizéry,-,-,-,-,-,-,-,-,-,-,-,-,-,-,-,-,-,-,-,-,-,-,-
E854,Jiná psychofarmaka,-,-,-,-,-,-,-,-,-,-,-,-,-,-,-,-,-,-,-,-,-,-,-
E855,Jiné látky působící na centrální a  (nebo) autonomní nervovou soustavu,-,-,-,-,-,-,-,-,-,-,-,-,-,-,-,-,-,-,-,-,-,-,-
E856,Antibiotika,-,-,-,-,-,-,-,-,-,-,-,-,-,-,-,-,-,-,-,-,-,-,-
E857,Jiné prostředky proti infekcím,-,-,-,-,-,-,-,-,-,-,-,-,-,-,-,-,-,-,-,-,-,-,-
E858,"Jiné léky, chemické a biologické látky",1,-,-,-,-,-,-,-,-,-,-,1,-,-,-,-,-,-,-,-,-,-,-
,,,,,,,,,,,,,,,,,,,,,,,,
,"Náhodné otravy jinými pevnými a tekutými látkami, plyny a parami",305,1,-,1,-,-,-,2,22,14,18,27,27,34,24,19,24,17,10,23,21,16,5
E860,"Alkohol, nezařazený jinde",70,-,-,-,-,-,-,-,1,2,7,11,14,16,7,4,4,3,-,1,-,-,-
E861,"Čisticí, lešticí a dezinfekční prostředky, barvy a laky",2,-,-,-,-,-,-,-,1,-,-,1,-,-,-,-,-,-,-,-,-,-,-
E862,"Výrobky z ropy, jiná rozpustidla jejich páry, nezařazené jinde",13,-,-,-,-,-,-,1,7,4,-,1,-,-,-,-,-,-,-,-,-,-,-
E863,Chemické a farmaceutické přípravky pro zemědělství a zahradnictví mimo přípravky pro výživu rostlin a umělá hnojiva,3,-,-,-,-,-,-,-,-,-,-,-,-,-,1,1,-,1,-,-,-,-,-
E864,"Žíravé a leptavé látky, nezařazené jinde",-,-,-,-,-,-,-,-,-,-,-,-,-,-,-,-,-,-,-,-,-,-,-
E865,Potraviny a jedovaté rostliny,12,-,-,1,-,-,-,-,1,-,2,-,-,1,-,1,-,2,3,1,-,-,-
E866,Jiné a NS pevné a tekuté látky,4,-,-,-,-,-,-,-,1,-,-,-,1,-,1,-,1,-,-,-,-,-,-
E867,Plyn rozváděný potrubím,47,-,-,-,-,-,-,-,2,1,5,2,2,3,-,2,2,4,5,5,7,6,1
E868,Jiný užitkový plyn nebo jiný kysličník uhelnatý,148,1,-,-,-,-,-,1,8,7,4,10,9,13,15,11,17,7,2,16,13,10,4
E869,Jiné plyny a páry,6,-,-,-,-,-,-,-,1,-,-,2,1,1,-,-,-,-,-,-,1,-,-
,,,,,,,,,,,,,,,,,,,,,,,,
,"Nehody, které postihly pacienty při lékařské péči",2,-,-,-,-,-,-,-,-,-,-,-,-,1,-,-,-,-,-,1,-,-,-
E870,"Náhodné říznutí, píchnutí, perforace nebo krvácení při lékařské péči",-,-,-,-,-,-,-,-,-,-,-,-,-,-,-,-,-,-,-,-,-,-,-
E871,Cizí předmět ponechaný v těle při výkonu,-,-,-,-,-,-,-,-,-,-,-,-,-,-,-,-,-,-,-,-,-,-,-
E872,Selhání sterilizačních opatření při výkonu,1,-,-,-,-,-,-,-,-,-,-,-,-,-,-,-,-,-,-,1,-,-,-
E873,Chyba v dávkování,-,-,-,-,-,-,-,-,-,-,-,-,-,-,-,-,-,-,-,-,-,-,-
E874,Mechanické selhání nástroje nebo přístroje při výkonu,-,-,-,-,-,-,-,-,-,-,-,-,-,-,-,-,-,-,-,-,-,-,-
E875,"Kontaminovaná nebo infikovaná krev, jiná tekutina, lék nebo biologická látka",1,-,-,-,-,-,-,-,-,-,-,-,-,1,-,-,-,-,-,-,-,-,-
E876,Jiné a NS nehody při lékařské péči,-,-,-,-,-,-,-,-,-,-,-,-,-,-,-,-,-,-,-,-,-,-,-
,,,,,,,,,,,,,,,,,,,,,,,,
,"Lékařské výkony  jako příčiny abnormální reakce pacienta nebo pozdější komlikace, bez nehody při výkonu",1,-,-,-,-,-,-,-,-,-,-,-,1,-,-,-,-,-,-,-,-,-,-
E878,"Chirurgická operace nebo jiný chirurgický výkon, bez nehody při výkonu, jako příčina abnormální reakce pacienta nebo pozdější komlikace",1,-,-,-,-,-,-,-,-,-,-,-,1,-,-,-,-,-,-,-,-,-,-
E879,"Jiný výkon, bez nehody při výkonu, jako příčina abnormální reakce pacienta nebo pozdější komlikace",-,-,-,-,-,-,-,-,-,-,-,-,-,-,-,-,-,-,-,-,-,-,-
,,,,,,,,,,,,,,,,,,,,,,,,
,Náhodné pády,1038,2,-,1,1,-,3,7,17,11,14,17,31,32,22,35,56,63,56,136,206,180,148
E880,Pád na schodech nebo se schodů nebo stupňů,41,-,-,-,-,-,1,1,-,1,-,-,1,2,2,5,4,6,2,3,5,5,3
E881,Pád na žebříku nebo se žebříku nebo lešení,27,-,-,-,-,-,-,-,1,2,3,-,3,-,-,4,3,2,1,4,2,2,-
E882,Pád z budovy nebo jiné stavby,45,-,-,1,-,-,1,2,2,3,4,1,4,1,6,1,10,2,1,1,3,-,2
E883,Pád do jámy nebo jiného otvoru v půdě,10,-,-,-,-,-,-,1,3,-,1,1,1,-,-,-,-,1,-,1,-,-,1
E884,Jiný pád z jedné úrovně na jinou,78,1,-,-,-,-,-,3,3,4,4,4,4,5,5,6,10,6,-,5,5,10,3
E885,"Pád na rovině následkem uklouznutí, zakopnutí nebo klopýtnutí",722,-,-,-,-,-,-,-,4,-,2,4,8,8,6,12,19,39,44,113,176,152,135
E886,"Pád na rovině následkem srážky s jinou osobou, strčení  jinou osobou apod.",-,-,-,-,-,-,-,-,-,-,-,-,-,-,-,-,-,-,-,-,-,-,-
E887,Zlomenina z neudané příčiny,42,-,-,-,-,-,-,-,-,-,-,3,4,5,2,4,4,1,2,5,6,5,1
E888,"Pád, jiný nebo NS",73,1,-,-,1,-,1,-,4,1,-,4,6,11,1,3,6,6,6,4,9,6,3
,,,,,,,,,,,,,,,,,,,,,,,,
,Úrazy způsobené ohněm,72,-,-,1,-,-,-,3,1,4,2,6,4,-,6,2,6,8,4,6,5,6,8
E890,Požár v obytném domě,16,-,-,-,-,-,-,-,-,1,1,-,1,-,-,1,1,3,-,1,1,2,4
E891,Požár v jiné nebo NS budově nebo stavbě,-,-,-,-,-,-,-,-,-,-,-,-,-,-,-,-,-,-,-,-,-,-,-
E892,Požár mimo budovy a stavby,3,-,-,-,-,-,-,-,-,-,-,-,-,-,-,-,1,-,-,2,-,-,-
E893,Úraz způsobený vznícením oděvu,4,-,-,-,-,-,-,-,-,-,1,1,-,-,-,-,-,1,1,-,-,-,-
E894,Vznícení vysoce vznětlivých hmot,-,-,-,-,-,-,-,-,-,-,-,-,-,-,-,-,-,-,-,-,-,-,-
E895,Úraz způsobený kontrolovaným ohněm v obytném domě,2,-,-,-,-,-,-,-,-,-,-,-,-,-,-,-,-,-,1,-,1,-,-
E896,Úraz způsobený kontrolovaným ohněm v jiné nebo NS budově nebo stavbě,1,-,-,-,-,-,-,-,-,-,-,-,-,-,-,-,-,-,-,-,-,-,1
E897,Úraz způsobený kontrolovaným ohněm mimo budovy a stavby,-,-,-,-,-,-,-,-,-,-,-,-,-,-,-,-,-,-,-,-,-,-,-
E898,Úraz způsobený jiným blíže popsaným ohněm ,3,-,-,-,-,-,-,-,-,-,-,-,-,-,1,-,1,-,-,-,-,1,-
E899,Úraz způsobený NS ohněm ,43,-,-,1,-,-,-,3,1,3,-,5,3,-,5,1,3,4,2,3,3,3,3
,,,,,,,,,,,,,,,,,,,,,,,,
,Úrazy způsobené přírodními vlivy nebo vlivy životního prostředí,102,-,1,-,-,-,-,-,2,4,1,4,5,10,10,8,12,15,7,8,7,5,3
E900,Nadměrné horko,1,-,1,-,-,-,-,-,-,-,-,-,-,-,-,-,-,-,-,-,-,-,-
E901,Nadměrný chlad,92,-,-,-,-,-,-,-,1,3,1,4,3,10,8,8,12,14,6,8,7,4,3
E902,Vysoký nebo nízký tlak vzduchu a jeho změny,-,-,-,-,-,-,-,-,-,-,-,-,-,-,-,-,-,-,-,-,-,-,-
E903,Cestovaní a pohyb,-,-,-,-,-,-,-,-,-,-,-,-,-,-,-,-,-,-,-,-,-,-,-
E904,"Hlad, žízeň, jiné strádání, nedostatek péče",-,-,-,-,-,-,-,-,-,-,-,-,-,-,-,-,-,-,-,-,-,-,-
E905,Jedovatá zvířata a rostliny jako příčina otravy nebo toxické reakce,1,-,-,-,-,-,-,-,-,-,-,-,-,-,-,-,-,1,-,-,-,-,-
E906,Jiná poranění způsobení zvířaty,7,-,-,-,-,-,-,-,-,1,-,-,2,-,2,-,-,-,1,-,-,1,-
E907,Blesk,1,-,-,-,-,-,-,-,1,-,-,-,-,-,-,-,-,-,-,-,-,-,-
E908,Živelní pohromy a záplavy jimi způsobené,-,-,-,-,-,-,-,-,-,-,-,-,-,-,-,-,-,-,-,-,-,-,-
E909,Katastrofální pohyby zemského povrchu a (sopečné) výbuchy,-,-,-,-,-,-,-,-,-,-,-,-,-,-,-,-,-,-,-,-,-,-,-
,,,,,,,,,,,,,,,,,,,,,,,,
,"Úrazy způsobené potopením, dušením a cizími tělesy",456,57,8,3,4,2,22,16,23,30,30,36,35,32,22,20,22,29,16,27,12,8,2
E910,Náhodné potopení nebo (u)tonutí,227,1,5,1,3,-,21,13,16,24,18,15,19,13,10,9,8,17,11,12,5,5,1
E911,Ucpání dýchacích cest nebo (za)dušení způsobené vdechnutím nebo polknutím potravy,181,47,2,1,1,2,-,3,7,4,11,12,13,15,9,7,11,10,4,13,5,3,1
E912,Ucpání dýchacích cest nebo (za)dušení způsobené vdechnutím nebo polknutím jiného předmětu,7,-,-,-,-,-,-,-,-,-,1,-,2,2,-,-,-,1,-,-,1,-,-
E913,Náhodné mechanické (za)dušení,40,9,1,1,-,-,1,-,-,2,-,9,1,2,3,3,3,1,1,2,1,-,-
E914,Náhodné vniknutí cizího tělesa do oka nebo očních adnex,-,-,-,-,-,-,-,-,-,-,-,-,-,-,-,-,-,-,-,-,-,-,-
E915,Náhodné vniknutí cizího tělesa do jiného otvoru,1,-,-,-,-,-,-,-,-,-,-,-,-,-,-,1,-,-,-,-,-,-,-
,,,,,,,,,,,,,,,,,,,,,,,,
,Jiné úrazy,373,2,5,-,-,-,5,7,22,35,32,42,41,33,27,17,28,20,13,18,15,6,5
E916,Náhodné udeření padajícím předmětem,49,-,-,-,-,-,2,1,3,5,6,7,8,4,2,3,4,-,1,-,2,1,-
E917,Náhodný náraz na předmět nebo osobu nebo náhodné udeření předmětem nebo osobou,3,1,-,-,-,-,-,1,-,-,-,-,-,-,-,1,-,-,-,-,-,-,-
E918,Náhodné zachycení v předmětech nebo mezi nimi,4,-,1,-,-,-,-,-,-,-,-,2,-,-,1,-,-,-,-,-,-,-,-
E919,Úrazy způsobené stroji,22,-,-,-,-,-,-,-,1,5,3,6,1,2,-,1,1,1,-,-,-,1,-
E920,"Úrazy způsobené řeznými, sečnými nebo bodnými nástroji nebo předměty",6,-,-,-,-,-,-,-,-,-,-,2,-,1,1,-,-,1,1,-,-,-,-
E921,Úraz způsobený  výbuchem tlakové nádoby,13,-,-,-,-,-,-,-,1,-,2,-,3,1,2,2,1,-,-,1,-,-,-
E922,Úraz způsobený střelou ze střelné zbraně ,8,-,-,-,-,-,-,1,2,2,-,-,1,-,-,-,1,-,1,-,-,-,-
E923,Úraz způsobený výbušninou,12,-,-,-,-,-,1,-,2,-,2,1,2,3,1,-,-,-,-,-,-,-,-
E924,"Úraz způsobený horkou látkou nebo předmětem, žíravou nebo leptavou látkou nebo parou",7,-,1,-,-,-,-,-,-,-,-,-,-,1,1,-,2,-,-,-,2,-,-
E925,Úraz způsobený elektrickým proudem,44,1,2,-,-,-,1,2,5,3,7,4,8,4,2,1,1,-,1,2,-,-,-
E926,Účinky záření,-,-,-,-,-,-,-,-,-,-,-,-,-,-,-,-,-,-,-,-,-,-,-
E927,Přepětí nebo namožení,-,-,-,-,-,-,-,-,-,-,-,-,-,-,-,-,-,-,-,-,-,-,-
E928,Jiné a NS vlivy prostředí a náhodné příčiny,205,-,1,-,-,-,1,2,8,20,12,20,18,17,17,9,18,18,9,15,11,4,5
,,,,,,,,,,,,,,,,,,,,,,,,
,Pozdní následky náhodných poranění,1,-,-,-,-,-,-,-,-,-,-,-,-,-,-,-,1,-,-,-,-,-,-
E929,Pozdní následky náhodných poranění,1,-,-,-,-,-,-,-,-,-,-,-,-,-,-,-,1,-,-,-,-,-,-
,,,,,,,,,,,,,,,,,,,,,,,,
,"Látky, chemické a biologické látky, vyvolavší nepříznivé účinky při léčebném použití",7,-,-,-,-,-,-,-,-,-,1,1,-,-,1,1,-,2,-,-,1,-,-
E930,Antibiotika,1,-,-,-,-,-,-,-,-,-,-,-,-,-,-,-,-,1,-,-,-,-,-
E931,Jiné prostředky proti infekcím,-,-,-,-,-,-,-,-,-,-,-,-,-,-,-,-,-,-,-,-,-,-,-
E932,Hormony a jejich syntetické náhrady,-,-,-,-,-,-,-,-,-,-,-,-,-,-,-,-,-,-,-,-,-,-,-
E933,Látky působící přímo na celý organismus,-,-,-,-,-,-,-,-,-,-,-,-,-,-,-,-,-,-,-,-,-,-,-
E934,Látky působící především na složky krve,-,-,-,-,-,-,-,-,-,-,-,-,-,-,-,-,-,-,-,-,-,-,-
E935,"Analgetika, antipyretika a antirevmatika",-,-,-,-,-,-,-,-,-,-,-,-,-,-,-,-,-,-,-,-,-,-,-
E936,Antikonvulzíva a léky proti Parkinsonově nemoci,-,-,-,-,-,-,-,-,-,-,-,-,-,-,-,-,-,-,-,-,-,-,-
E937,Sedativa  a hypnotika,-,-,-,-,-,-,-,-,-,-,-,-,-,-,-,-,-,-,-,-,-,-,-
E938,Jiné látky s tlumivým účinkem na centrální nervovou soustavu,1,-,-,-,-,-,-,-,-,-,1,-,-,-,-,-,-,-,-,-,-,-,-
E939,Psychofarmaka,1,-,-,-,-,-,-,-,-,-,-,-,-,-,1,-,-,-,-,-,-,-,-
E940,Stimulancia centrální nervové soustavy,1,-,-,-,-,-,-,-,-,-,-,-,-,-,-,-,-,1,-,-,-,-,-
E941,Látky působící především na autonomní nervovou soustavu,-,-,-,-,-,-,-,-,-,-,-,-,-,-,-,-,-,-,-,-,-,-,-
E942,Látky působící především na oběhovou soustavu,-,-,-,-,-,-,-,-,-,-,-,-,-,-,-,-,-,-,-,-,-,-,-
E943,Látky působící především na trávicí soustavu,1,-,-,-,-,-,-,-,-,-,-,-,-,-,-,-,-,-,-,-,1,-,-
E944,"Látky působící na metabolismus vody, minerálů a kyseliny močové",-,-,-,-,-,-,-,-,-,-,-,-,-,-,-,-,-,-,-,-,-,-,-
E945,Látky působící především na hladké nebo kosterní svaly nebo na dýchací soustavu,-,-,-,-,-,-,-,-,-,-,-,-,-,-,-,-,-,-,-,-,-,-,-
E946,"Látky působící především na kůži a sliznici, prostředky oftalmologické, otorinolaryngologické a stomatologické",-,-,-,-,-,-,-,-,-,-,-,-,-,-,-,-,-,-,-,-,-,-,-
E947,Jiné a NS léky a přípravky,2,-,-,-,-,-,-,-,-,-,-,1,-,-,-,1,-,-,-,-,-,-,-
E948,Očkovací látky proti bakteriím,-,-,-,-,-,-,-,-,-,-,-,-,-,-,-,-,-,-,-,-,-,-,-
E949,Jiné očkovací a biologické látky,-,-,-,-,-,-,-,-,-,-,-,-,-,-,-,-,-,-,-,-,-,-,-
,,,,,,,,,,,,,,,,,,,,,,,,
SE,Sebevraždy a sebopoškození,1509,-,-,-,-,-,-,10,39,56,100,141,170,134,119,121,121,114,72,117,110,59,26
E950,Otrava pevnou nebo kapalnou látkou,87,-,-,-,-,-,-,-,4,6,3,12,11,5,11,6,8,7,3,4,4,2,1
E951,Otrava plynem používaným v domácnosti,106,-,-,-,-,-,-,-,3,8,13,16,10,11,6,7,3,3,5,5,6,7,3
E952,Otrava jiným plynem nebo výpary,43,-,-,-,-,-,-,-,-,-,6,8,7,8,2,4,2,3,-,2,-,1,-
E953,"Oběšení, uškrcení nebo udušení",951,-,-,-,-,-,-,10,26,28,50,75,98,83,84,73,76,85,45,78,86,42,12
E954, (U)topení,31,-,-,-,-,-,-,-,-,1,4,3,3,3,-,3,3,1,2,2,1,2,3
E955,Sebevražda nebo sebepoškození střelnou zbraní nebo výbušninou,102,-,-,-,-,-,-,-,1,4,4,9,18,9,8,13,8,2,6,13,4,-,3
E956,"Sebevražda nebo sebepoškození řezným, sečným nebo bodným nástrojem ",40,-,-,-,-,-,-,-,-,-,5,5,6,2,1,5,6,5,2,1,-,2,-
E957,Sebevražda nebo sebepoškození skokem s výše,74,-,-,-,-,-,-,-,3,5,7,3,12,4,2,3,8,3,6,7,6,3,2
E958,Sebevražda nebo sebepoškození jiným nebo NS způsobem,74,-,-,-,-,-,-,-,2,4,8,10,5,9,5,7,6,5,3,5,3,-,2
E959,Pozdní následky pokusu o sebevraždu nebo sebepoškození ,1,-,-,-,-,-,-,-,-,-,-,-,-,-,-,-,1,-,-,-,-,-,-
,,,,,,,,,,,,,,,,,,,,,,,,
NA,Usmrcení nebo poranění způsobená úmyslně jinými osobami,47,5,1,-,-,1,-,1,1,3,5,6,6,7,4,2,2,-,2,-,-,-,-
E960,"Zápas, rvačka, znásilnění",5,-,-,-,-,-,-,-,1,-,1,1,1,1,-,-,-,-,-,-,-,-,-
E961,"Napadení žíravou nebo leptavou látkou, mimo otravu",-,-,-,-,-,-,-,-,-,-,-,-,-,-,-,-,-,-,-,-,-,-,-
E962,Otrávení,2,1,-,-,-,-,-,-,-,-,-,-,-,1,-,-,-,-,-,-,-,-,-
E963,Oběšení nebo (u)škrcení,3,2,-,-,-,1,-,-,-,-,-,-,-,-,-,-,-,-,-,-,-,-,-
E964, (U)topení,2,1,-,-,-,-,-,-,-,-,1,-,-,-,-,-,-,-,-,-,-,-,-
E965,Napadení střelnou zbraní nebo výbušninou,1,-,-,-,-,-,-,-,-,-,-,-,-,-,1,-,-,-,-,-,-,-,-
E966,"Napadení řezným, sečným nebo bodným nástrojem ",20,-,-,-,-,-,-,1,-,3,2,1,3,3,1,2,2,-,2,-,-,-,-
E967,Bití nebo jiné týrání dítěte,-,-,-,-,-,-,-,-,-,-,-,-,-,-,-,-,-,-,-,-,-,-,-
E968,Napadení jiným nebo NS způsobem,13,1,1,-,-,-,-,-,-,-,1,4,2,2,2,-,-,-,-,-,-,-,-
E969,Pozdní následky poranění způsobeného úmyslně jinou osobou,-,-,-,-,-,-,-,-,-,-,-,-,-,-,-,-,-,-,-,-,-,-,-
,,,,,,,,,,,,,,,,,,,,,,,,
,Zákonný zákrok,1,-,-,-,-,-,-,-,-,-,-,-,-,-,-,-,1,-,-,-,-,-,-
E970,Zákonný zákrok střelnou zbraní,-,-,-,-,-,-,-,-,-,-,-,-,-,-,-,-,-,-,-,-,-,-,-
E971,Zákonný zákrok výbušninou,-,-,-,-,-,-,-,-,-,-,-,-,-,-,-,-,-,-,-,-,-,-,-
E972,Zákonný zákrok plynem,-,-,-,-,-,-,-,-,-,-,-,-,-,-,-,-,-,-,-,-,-,-,-
E973,Zákonný zákrok tupým předmětem,-,-,-,-,-,-,-,-,-,-,-,-,-,-,-,-,-,-,-,-,-,-,-
E974,"Zákonný zákrok řezným, sečným nebo bodným nástrojem",-,-,-,-,-,-,-,-,-,-,-,-,-,-,-,-,-,-,-,-,-,-,-
E975,Zákonný zákrok jiným popsaným způsobem,-,-,-,-,-,-,-,-,-,-,-,-,-,-,-,-,-,-,-,-,-,-,-
E976,Zákonný zákrok NS způsobem,-,-,-,-,-,-,-,-,-,-,-,-,-,-,-,-,-,-,-,-,-,-,-
E977,Pozdní následky poranění způsobeného zákonným zákrokem,1,-,-,-,-,-,-,-,-,-,-,-,-,-,-,-,1,-,-,-,-,-,-
E978,Zákonná poprava,-,-,-,-,-,-,-,-,-,-,-,-,-,-,-,-,-,-,-,-,-,-,-
,,,,,,,,,,,,,,,,,,,,,,,,
,"Poranění, o kterých nebylo zjištěno, zdali byla náhodná či způsobena úmyslně",222,3,-,-,1,-,1,3,9,14,14,18,15,16,19,12,19,14,12,20,13,14,5
E980,Otrava pevnou nebo kapalnou látkou,19,-,-,-,-,-,-,-,1,1,2,6,-,1,1,1,-,2,1,1,-,2,-
E981,Otrava plynem používaným v domácnosti,25,-,-,-,1,-,-,-,-,1,1,5,1,3,1,3,3,3,-,-,-,3,-
E982,Otrava jiným plynem nebo výpary,10,-,-,-,-,-,-,1,-,-,2,-,5,1,-,-,-,-,1,-,-,-,-
E983,"Oběšení, uškrcení nebo zadušení",4,-,-,-,-,-,-,1,-,-,-,-,-,1,-,-,-,-,-,1,-,-,1
E984,Utonutí,13,-,-,-,-,-,-,-,1,2,2,1,-,1,1,-,2,-,-,1,-,2,-
E985,Poranění střelnou zbraní nebo výbušninou,4,-,-,-,-,-,-,-,2,1,-,-,-,-,1,-,-,-,-,-,-,-,-
E986,"Poranění řezným, sečným nebo bodným nástrojem ",3,-,-,-,-,-,-,-,-,1,-,-,-,1,-,-,-,1,-,-,-,-,-
E987,Pád s výše,2,-,-,-,-,-,-,-,-,-,-,-,-,-,-,1,-,-,-,-,-,-,1
E988,Poranění jiným nebo NS způsobem,141,3,-,-,-,-,1,1,5,8,7,6,9,8,14,7,14,8,10,17,13,7,3
E989,"Pozdní následky poranění, o ketrých nebylo zjištěno zda byla náhodná či způsobena úmyslně ",1,-,-,-,-,-,-,-,-,-,-,-,-,-,1,-,-,-,-,-,-,-,-
,,,,,,,,,,,,,,,,,,,,,,,,
,Poranění vzniklá válečnými operacemi,-,-,-,-,-,-,-,-,-,-,-,-,-,-,-,-,-,-,-,-,-,-,-