1989,Zemřelé ženy podle podrobného seznamu příčin smrti a věku - úrazy a otravy podle vnější příčiny,,,,,,,,,,,,,,,,,,,,,,,
MKN (1976),Název,Celkem,0,1,2,3,4,5-9,10-14,15-19,20-24,25-29,30-34,35-39,40-44,45-49,50-54,55-59,60-64,65-69,70-74,75-79,80-84,85+
,,,,,,,,,,,,,,,,,,,,,,,,
VN,Vnější příčiny poranění a otrav,3643,30,12,5,4,8,16,12,54,58,44,67,83,92,109,94,96,134,238,201,602,769,915
,,,,,,,,,,,,,,,,,,,,,,,,
D1,Úrazy na železnicích,44,-,-,1,-,-,-,-,5,2,1,2,2,3,1,2,3,2,5,4,2,5,4
E800,Srážka se železničními vozidly,1,-,-,-,-,-,-,-,-,-,-,-,1,-,-,-,-,-,-,-,-,-,-
E801,Náraz na jiný předmět,-,-,-,-,-,-,-,-,-,-,-,-,-,-,-,-,-,-,-,-,-,-,-
E802,Vykolejení bez předchozí srážky nebo nárazu,1,-,-,-,-,-,-,-,1,-,-,-,-,-,-,-,-,-,-,-,-,-,-
E803,"Výbuch, oheň nebo popálení",-,-,-,-,-,-,-,-,-,-,-,-,-,-,-,-,-,-,-,-,-,-,-
E804,Pád ve vlaku nebo z vlaku,5,-,-,-,-,-,-,-,2,-,-,-,-,-,1,-,-,-,-,-,-,2,-
E805,Zasažení železničním vozidlem,35,-,-,1,-,-,-,-,2,2,1,2,1,3,-,1,3,2,5,4,1,3,4
E806,Jiný blíže popsaný úraz  na železnici,-,-,-,-,-,-,-,-,-,-,-,-,-,-,-,-,-,-,-,-,-,-,-
E807,Železniční úraz NS,2,-,-,-,-,-,-,-,-,-,-,-,-,-,-,1,-,-,-,-,1,-,-
,,,,,,,,,,,,,,,,,,,,,,,,
D2,Provozní úrazy motorovými vozidly,311,-,-,2,1,2,10,4,24,15,10,9,15,22,21,20,17,18,30,8,41,30,12
E810,Srážka motorového vozidla s vlakem,-,-,-,-,-,-,-,-,-,-,-,-,-,-,-,-,-,-,-,-,-,-,-
E811,Srážka motorového vozidla s jiným motorovým vozidlem při návratu do jízdní dráhy,3,-,-,-,-,-,-,-,-,1,-,-,1,1,-,-,-,-,-,-,-,-,-
E812,Jiná srážka motorového vozidla s jiným motorovým vozidel,28,-,-,-,-,2,-,-,-,4,1,1,2,1,3,5,2,2,4,-,-,1,-
E813,Srážka motorového vozidla s jiným vozidlem,8,-,-,-,-,-,1,-,-,-,-,-,1,2,-,-,-,1,2,-,1,-,-
E814,Srážka motorového vozidla s chodcem,89,-,-,1,-,-,3,2,5,1,4,-,3,5,4,7,9,5,3,4,18,12,3
E815,Jiný náraz motorového vozidla na předmět na silnici,8,-,-,-,-,-,1,-,1,1,-,-,1,1,2,1,-,-,-,-,-,-,-
E816,"Ztráta vlády nad motorovým vozidlem na silnici, beze srážky",9,-,-,-,-,-,-,-,2,-,-,2,1,1,2,-,-,-,1,-,-,-,-
E817,"Úraz při nastupování nebo vystupování, bez srážky",-,-,-,-,-,-,-,-,-,-,-,-,-,-,-,-,-,-,-,-,-,-,-
E818,Jiný provozní úraz motorovým vozidlem bez srážky,1,-,-,-,-,-,-,-,1,-,-,-,-,-,-,-,-,-,-,-,-,-,-
E819,"Jiný provozní úraz motorovým vozidlem, bez srážky",165,-,-,1,1,-,5,2,15,8,5,6,6,11,10,7,6,10,20,4,22,17,9
,,,,,,,,,,,,,,,,,,,,,,,,
D3,Neprovozní úrazy motorovými vozidly,1,-,-,-,-,-,-,-,-,-,-,-,-,-,-,-,-,-,-,-,-,1,-
E820,Neprovozní úraz motorovým vozidlem pro jizdu na sněhu,1,-,-,-,-,-,-,-,-,-,-,-,-,-,-,-,-,-,-,-,-,1,-
E821,Neprovozní úraz jiným mimosilničním motorovým vozidlem ,-,-,-,-,-,-,-,-,-,-,-,-,-,-,-,-,-,-,-,-,-,-,-
E822,Neprovozní úraz jiným motorovým vozidlem při srážce s pohybujícím se předmětem,-,-,-,-,-,-,-,-,-,-,-,-,-,-,-,-,-,-,-,-,-,-,-
E823,Neprovozní úraz  jiným motorovým vozidlem při nárazu na nepohybující se předmět,-,-,-,-,-,-,-,-,-,-,-,-,-,-,-,-,-,-,-,-,-,-,-
E824,Neprovozní úraz jiným motorovým vozidlem při nastupování nebo vystupování,-,-,-,-,-,-,-,-,-,-,-,-,-,-,-,-,-,-,-,-,-,-,-
E825,Neprovozní úraz jiné nebo NS povahy jiným  motorovým vozidlem,-,-,-,-,-,-,-,-,-,-,-,-,-,-,-,-,-,-,-,-,-,-,-
,,,,,,,,,,,,,,,,,,,,,,,,
D4,Úrazy jinými silničními vozidly,14,-,-,-,-,-,-,-,1,-,-,1,2,1,1,1,-,1,3,-,-,3,-
E826,Úraz způsobený jizdním kolem,9,-,-,-,-,-,-,-,-,-,-,1,1,1,1,1,-,1,3,-,-,-,-
E827,Úraz způsobený vozidlem taženým zvířaty,-,-,-,-,-,-,-,-,-,-,-,-,-,-,-,-,-,-,-,-,-,-,-
E828,Úraz způsobený zvířetem nesousím člověka,1,-,-,-,-,-,-,-,1,-,-,-,-,-,-,-,-,-,-,-,-,-,-
E829,Úrazy způsobené jinými silničními vozidly,4,-,-,-,-,-,-,-,-,-,-,-,1,-,-,-,-,-,-,-,-,3,-
,,,,,,,,,,,,,,,,,,,,,,,,
D5,Úrazy při vodní dopravě,-,-,-,-,-,-,-,-,-,-,-,-,-,-,-,-,-,-,-,-,-,-,-
E830,"Nehoda plavidla (srážka, ztroskotání, převržení) mající za následek potopení osoby",-,-,-,-,-,-,-,-,-,-,-,-,-,-,-,-,-,-,-,-,-,-,-
E831,Jiný úraz při  nehodě plavidla,-,-,-,-,-,-,-,-,-,-,-,-,-,-,-,-,-,-,-,-,-,-,-
E832,Jiné náhodné potopení nebo (u)tonutí při vodní dopravě,-,-,-,-,-,-,-,-,-,-,-,-,-,-,-,-,-,-,-,-,-,-,-
E833,Pád na schodech nebo žebříku při vodní dopravě,-,-,-,-,-,-,-,-,-,-,-,-,-,-,-,-,-,-,-,-,-,-,-
E834,Jiný pád s jedné úrovně na jinou při vodní dopravě,-,-,-,-,-,-,-,-,-,-,-,-,-,-,-,-,-,-,-,-,-,-,-
E835,Jiný nebo NS pád při vodní dopravě,-,-,-,-,-,-,-,-,-,-,-,-,-,-,-,-,-,-,-,-,-,-,-
E836,Úraz u stroje při vodní dopravě,-,-,-,-,-,-,-,-,-,-,-,-,-,-,-,-,-,-,-,-,-,-,-
E837,"Výbuch, oheň nebo popálení na plavidle",-,-,-,-,-,-,-,-,-,-,-,-,-,-,-,-,-,-,-,-,-,-,-
E838,Jiný nebo NS úraz při vodní dopravě,-,-,-,-,-,-,-,-,-,-,-,-,-,-,-,-,-,-,-,-,-,-,-
,,,,,,,,,,,,,,,,,,,,,,,,
D6,Úrazy při dopravě vzduchem a mimovzdušným prostorem,-,-,-,-,-,-,-,-,-,-,-,-,-,-,-,-,-,-,-,-,-,-,-
E840,Nehoda motorového letadla při stratu nebo přistávání,-,-,-,-,-,-,-,-,-,-,-,-,-,-,-,-,-,-,-,-,-,-,-
E841,Jiná nebo NS nehoda motorového letadla,-,-,-,-,-,-,-,-,-,-,-,-,-,-,-,-,-,-,-,-,-,-,-
E842,Nehoda letadla bez motoru,-,-,-,-,-,-,-,-,-,-,-,-,-,-,-,-,-,-,-,-,-,-,-
E843,Pád v letadle nebo z letadla,-,-,-,-,-,-,-,-,-,-,-,-,-,-,-,-,-,-,-,-,-,-,-
E844,Jiný blíže psaný úraz při dopravě vzduchem,-,-,-,-,-,-,-,-,-,-,-,-,-,-,-,-,-,-,-,-,-,-,-
E845,Nehoda kosmické lodi,-,-,-,-,-,-,-,-,-,-,-,-,-,-,-,-,-,-,-,-,-,-,-
,,,,,,,,,,,,,,,,,,,,,,,,
D7,Úrazy způsobené vozidly a nezařaditelné jinam,-,-,-,-,-,-,-,-,-,-,-,-,-,-,-,-,-,-,-,-,-,-,-
E846,"Úrazy způsobené vozidly s motorovým pohonem, používanými jen v budovách a na pozemcích výrobního nebo obchodního závodu ",-,-,-,-,-,-,-,-,-,-,-,-,-,-,-,-,-,-,-,-,-,-,-
E847,"Úrazy způsobené lanovými vozy, nejedoucimi po kolejích ",-,-,-,-,-,-,-,-,-,-,-,-,-,-,-,-,-,-,-,-,-,-,-
E848,"Úrazy způsobené jinými vozidly, nezařaditelné jinam",-,-,-,-,-,-,-,-,-,-,-,-,-,-,-,-,-,-,-,-,-,-,-
,,,,,,,,,,,,,,,,,,,,,,,,
,"Náhodné otravy léky, chemickými látkami používanými v lékařství a biologickými látkami",7,1,-,-,-,1,-,-,-,-,-,-,1,-,1,-,-,-,-,-,1,1,1
E850,"Analgetika, antipyretika a antirevmatika",1,-,-,-,-,-,-,-,-,-,-,-,-,-,-,-,-,-,-,-,1,-,-
E851,Barbituráty,-,-,-,-,-,-,-,-,-,-,-,-,-,-,-,-,-,-,-,-,-,-,-
E852,Jiná sedativa a hypnotika,1,-,-,-,-,-,-,-,-,-,-,-,-,-,-,-,-,-,-,-,-,1,-
E853,Trankvilizéry,-,-,-,-,-,-,-,-,-,-,-,-,-,-,-,-,-,-,-,-,-,-,-
E854,Jiná psychofarmaka,1,-,-,-,-,1,-,-,-,-,-,-,-,-,-,-,-,-,-,-,-,-,-
E855,Jiné látky působící na centrální a  (nebo) autonomní nervovou soustavu,1,-,-,-,-,-,-,-,-,-,-,-,-,-,-,-,-,-,-,-,-,-,1
E856,Antibiotika,-,-,-,-,-,-,-,-,-,-,-,-,-,-,-,-,-,-,-,-,-,-,-
E857,Jiné prostředky proti infekcím,-,-,-,-,-,-,-,-,-,-,-,-,-,-,-,-,-,-,-,-,-,-,-
E858,"Jiné léky, chemické a biologické látky",3,1,-,-,-,-,-,-,-,-,-,-,1,-,1,-,-,-,-,-,-,-,-
,,,,,,,,,,,,,,,,,,,,,,,,
,"Náhodné otravy jinými pevnými a tekutými látkami, plyny a parami",145,-,1,-,1,-,1,-,3,1,2,4,3,3,4,4,4,7,13,17,26,32,19
E860,"Alkohol, nezařazený jinde",10,-,-,-,-,-,-,-,-,-,-,1,1,-,3,3,1,-,-,-,-,1,-
E861,"Čisticí, lešticí a dezinfekční prostředky, barvy a laky",-,-,-,-,-,-,-,-,-,-,-,-,-,-,-,-,-,-,-,-,-,-,-
E862,"Výrobky z ropy, jiná rozpustidla jejich páry, nezařazené jinde",-,-,-,-,-,-,-,-,-,-,-,-,-,-,-,-,-,-,-,-,-,-,-
E863,Chemické a farmaceutické přípravky pro zemědělství a zahradnictví mimo přípravky pro výživu rostlin a umělá hnojiva,-,-,-,-,-,-,-,-,-,-,-,-,-,-,-,-,-,-,-,-,-,-,-
E864,"Žíravé a leptavé látky, nezařazené jinde",-,-,-,-,-,-,-,-,-,-,-,-,-,-,-,-,-,-,-,-,-,-,-
E865,Potraviny a jedovaté rostliny,1,-,-,-,-,-,-,-,-,-,-,-,-,-,-,-,1,-,-,-,-,-,-
E866,Jiné a NS pevné a tekuté látky,-,-,-,-,-,-,-,-,-,-,-,-,-,-,-,-,-,-,-,-,-,-,-
E867,Plyn rozváděný potrubím,37,-,-,-,-,-,-,-,-,-,-,1,1,-,-,-,-,2,3,6,7,11,6
E868,Jiný užitkový plyn nebo jiný kysličník uhelnatý,97,-,1,-,1,-,1,-,3,1,2,2,1,3,1,1,2,5,10,11,19,20,13
E869,Jiné plyny a páry,-,-,-,-,-,-,-,-,-,-,-,-,-,-,-,-,-,-,-,-,-,-,-
,,,,,,,,,,,,,,,,,,,,,,,,
,"Nehody, které postihly pacienty při lékařské péči",-,-,-,-,-,-,-,-,-,-,-,-,-,-,-,-,-,-,-,-,-,-,-
E870,"Náhodné říznutí, píchnutí, perforace nebo krvácení při lékařské péči",-,-,-,-,-,-,-,-,-,-,-,-,-,-,-,-,-,-,-,-,-,-,-
E871,Cizí předmět ponechaný v těle při výkonu,-,-,-,-,-,-,-,-,-,-,-,-,-,-,-,-,-,-,-,-,-,-,-
E872,Selhání sterilizačních opatření při výkonu,-,-,-,-,-,-,-,-,-,-,-,-,-,-,-,-,-,-,-,-,-,-,-
E873,Chyba v dávkování,-,-,-,-,-,-,-,-,-,-,-,-,-,-,-,-,-,-,-,-,-,-,-
E874,Mechanické selhání nástroje nebo přístroje při výkonu,-,-,-,-,-,-,-,-,-,-,-,-,-,-,-,-,-,-,-,-,-,-,-
E875,"Kontaminovaná nebo infikovaná krev, jiná tekutina, lék nebo biologická látka",-,-,-,-,-,-,-,-,-,-,-,-,-,-,-,-,-,-,-,-,-,-,-
E876,Jiné a NS nehody při lékařské péči,-,-,-,-,-,-,-,-,-,-,-,-,-,-,-,-,-,-,-,-,-,-,-
,,,,,,,,,,,,,,,,,,,,,,,,
,"Lékařské výkony  jako příčiny abnormální reakce pacienta nebo pozdější komlikace, bez nehody při výkonu",2,-,-,-,-,-,-,-,-,-,-,-,-,-,2,-,-,-,-,-,-,-,-
E878,"Chirurgická operace nebo jiný chirurgický výkon, bez nehody při výkonu, jako příčina abnormální reakce pacienta nebo pozdější komlikace",2,-,-,-,-,-,-,-,-,-,-,-,-,-,2,-,-,-,-,-,-,-,-
E879,"Jiný výkon, bez nehody při výkonu, jako příčina abnormální reakce pacienta nebo pozdější komlikace",-,-,-,-,-,-,-,-,-,-,-,-,-,-,-,-,-,-,-,-,-,-,-
,,,,,,,,,,,,,,,,,,,,,,,,
,Náhodné pády,2109,-,2,-,-,-,1,1,2,1,3,2,4,3,7,7,20,30,93,107,422,599,805
E880,Pád na schodech nebo se schodů nebo stupňů,22,-,-,-,-,-,-,-,-,-,-,-,-,-,-,-,-,2,4,2,7,5,2
E881,Pád na žebříku nebo se žebříku nebo lešení,5,-,-,-,-,-,-,-,-,-,-,-,-,-,-,-,1,-,1,1,1,-,1
E882,Pád z budovy nebo jiné stavby,19,-,2,-,-,-,-,-,1,-,1,-,1,-,1,2,2,1,-,1,1,2,4
E883,Pád do jámy nebo jiného otvoru v půdě,4,-,-,-,-,-,1,-,-,-,-,-,-,-,-,-,-,1,1,-,-,1,-
E884,Jiný pád z jedné úrovně na jinou,37,-,-,-,-,-,-,-,-,1,1,1,1,1,2,-,1,2,2,1,5,9,10
E885,"Pád na rovině následkem uklouznutí, zakopnutí nebo klopýtnutí",1947,-,-,-,-,-,-,-,-,-,-,1,-,2,2,5,14,19,79,96,389,564,776
E886,"Pád na rovině následkem srážky s jinou osobou, strčení  jinou osobou apod.",1,-,-,-,-,-,-,-,-,-,-,-,-,-,-,-,-,-,-,-,-,-,1
E887,Zlomenina z neudané příčiny,23,-,-,-,-,-,-,-,-,-,-,-,-,-,-,-,-,1,1,1,9,7,4
E888,"Pád, jiný nebo NS",51,-,-,-,-,-,-,1,1,-,1,-,2,-,2,-,2,4,5,5,10,11,7
,,,,,,,,,,,,,,,,,,,,,,,,
,Úrazy způsobené ohněm,29,-,1,-,-,1,-,-,-,1,-,-,-,-,1,1,1,2,4,3,7,3,4
E890,Požár v obytném domě,7,-,1,-,-,-,-,-,-,-,-,-,-,-,-,-,-,1,1,1,1,1,1
E891,Požár v jiné nebo NS budově nebo stavbě,1,-,-,-,-,1,-,-,-,-,-,-,-,-,-,-,-,-,-,-,-,-,-
E892,Požár mimo budovy a stavby,-,-,-,-,-,-,-,-,-,-,-,-,-,-,-,-,-,-,-,-,-,-,-
E893,Úraz způsobený vznícením oděvu,1,-,-,-,-,-,-,-,-,-,-,-,-,-,-,-,-,-,-,1,-,-,-
E894,Vznícení vysoce vznětlivých hmot,2,-,-,-,-,-,-,-,-,1,-,-,-,-,-,-,-,-,1,-,-,-,-
E895,Úraz způsobený kontrolovaným ohněm v obytném domě,1,-,-,-,-,-,-,-,-,-,-,-,-,-,-,-,-,-,-,1,-,-,-
E896,Úraz způsobený kontrolovaným ohněm v jiné nebo NS budově nebo stavbě,-,-,-,-,-,-,-,-,-,-,-,-,-,-,-,-,-,-,-,-,-,-,-
E897,Úraz způsobený kontrolovaným ohněm mimo budovy a stavby,-,-,-,-,-,-,-,-,-,-,-,-,-,-,-,-,-,-,-,-,-,-,-
E898,Úraz způsobený jiným blíže popsaným ohněm ,1,-,-,-,-,-,-,-,-,-,-,-,-,-,-,-,-,-,-,-,1,-,-
E899,Úraz způsobený NS ohněm ,16,-,-,-,-,-,-,-,-,-,-,-,-,-,1,1,1,1,2,-,5,2,3
,,,,,,,,,,,,,,,,,,,,,,,,
,Úrazy způsobené přírodními vlivy nebo vlivy životního prostředí,22,-,-,-,-,-,1,-,1,-,-,-,1,1,2,4,1,2,2,1,3,1,2
E900,Nadměrné horko,-,-,-,-,-,-,-,-,-,-,-,-,-,-,-,-,-,-,-,-,-,-,-
E901,Nadměrný chlad,13,-,-,-,-,-,-,-,-,-,-,-,1,-,-,2,-,2,1,1,3,1,2
E902,Vysoký nebo nízký tlak vzduchu a jeho změny,-,-,-,-,-,-,-,-,-,-,-,-,-,-,-,-,-,-,-,-,-,-,-
E903,Cestovaní a pohyb,-,-,-,-,-,-,-,-,-,-,-,-,-,-,-,-,-,-,-,-,-,-,-
E904,"Hlad, žízeň, jiné strádání, nedostatek péče",-,-,-,-,-,-,-,-,-,-,-,-,-,-,-,-,-,-,-,-,-,-,-
E905,Jedovatá zvířata a rostliny jako příčina otravy nebo toxické reakce,6,-,-,-,-,-,-,-,-,-,-,-,-,1,2,2,1,-,-,-,-,-,-
E906,Jiná poranění způsobení zvířaty,1,-,-,-,-,-,-,-,-,-,-,-,-,-,-,-,-,-,1,-,-,-,-
E907,Blesk,2,-,-,-,-,-,1,-,1,-,-,-,-,-,-,-,-,-,-,-,-,-,-
E908,Živelní pohromy a záplavy jimi způsobené,-,-,-,-,-,-,-,-,-,-,-,-,-,-,-,-,-,-,-,-,-,-,-
E909,Katastrofální pohyby zemského povrchu a (sopečné) výbuchy,-,-,-,-,-,-,-,-,-,-,-,-,-,-,-,-,-,-,-,-,-,-,-
,,,,,,,,,,,,,,,,,,,,,,,,
,"Úrazy způsobené potopením, dušením a cizími tělesy",138,27,6,2,2,2,-,3,4,4,5,3,2,1,7,7,6,11,8,7,13,11,7
E910,Náhodné potopení nebo (u)tonutí,64,-,3,1,2,1,-,2,3,2,3,3,2,-,4,3,3,7,5,5,8,6,1
E911,Ucpání dýchacích cest nebo (za)dušení způsobené vdechnutím nebo polknutím potravy,64,26,2,1,-,1,-,1,-,2,-,-,-,1,3,4,3,3,2,2,4,4,5
E912,Ucpání dýchacích cest nebo (za)dušení způsobené vdechnutím nebo polknutím jiného předmětu,1,-,-,-,-,-,-,-,-,-,1,-,-,-,-,-,-,-,-,-,-,-,-
E913,Náhodné mechanické (za)dušení,9,1,1,-,-,-,-,-,1,-,1,-,-,-,-,-,-,1,1,-,1,1,1
E914,Náhodné vniknutí cizího tělesa do oka nebo očních adnex,-,-,-,-,-,-,-,-,-,-,-,-,-,-,-,-,-,-,-,-,-,-,-
E915,Náhodné vniknutí cizího tělesa do jiného otvoru,-,-,-,-,-,-,-,-,-,-,-,-,-,-,-,-,-,-,-,-,-,-,-
,,,,,,,,,,,,,,,,,,,,,,,,
,Jiné úrazy,95,-,1,-,-,-,1,-,1,5,4,4,4,2,6,3,4,5,5,4,11,18,17
E916,Náhodné udeření padajícím předmětem,3,-,-,-,-,-,-,-,-,-,-,-,-,1,1,-,-,-,1,-,-,-,-
E917,Náhodný náraz na předmět nebo osobu nebo náhodné udeření předmětem nebo osobou,1,-,-,-,-,-,-,-,-,-,-,-,-,-,1,-,-,-,-,-,-,-,-
E918,Náhodné zachycení v předmětech nebo mezi nimi,1,-,-,-,-,-,-,-,-,-,-,-,-,-,-,1,-,-,-,-,-,-,-
E919,Úrazy způsobené stroji,1,-,-,-,-,-,-,-,-,-,-,-,-,-,-,1,-,-,-,-,-,-,-
E920,"Úrazy způsobené řeznými, sečnými nebo bodnými nástroji nebo předměty",-,-,-,-,-,-,-,-,-,-,-,-,-,-,-,-,-,-,-,-,-,-,-
E921,Úraz způsobený  výbuchem tlakové nádoby,-,-,-,-,-,-,-,-,-,-,-,-,-,-,-,-,-,-,-,-,-,-,-
E922,Úraz způsobený střelou ze střelné zbraně ,-,-,-,-,-,-,-,-,-,-,-,-,-,-,-,-,-,-,-,-,-,-,-
E923,Úraz způsobený výbušninou,-,-,-,-,-,-,-,-,-,-,-,-,-,-,-,-,-,-,-,-,-,-,-
E924,"Úraz způsobený horkou látkou nebo předmětem, žíravou nebo leptavou látkou nebo parou",10,-,-,-,-,-,1,-,-,-,1,-,-,-,-,-,1,1,-,-,2,2,2
E925,Úraz způsobený elektrickým proudem,9,-,-,-,-,-,-,-,1,1,1,2,1,-,-,1,-,-,1,-,1,-,-
E926,Účinky záření,-,-,-,-,-,-,-,-,-,-,-,-,-,-,-,-,-,-,-,-,-,-,-
E927,Přepětí nebo namožení,-,-,-,-,-,-,-,-,-,-,-,-,-,-,-,-,-,-,-,-,-,-,-
E928,Jiné a NS vlivy prostředí a náhodné příčiny,70,-,1,-,-,-,-,-,-,4,2,2,3,1,4,-,3,4,3,4,8,16,15
,,,,,,,,,,,,,,,,,,,,,,,,
,Pozdní následky náhodných poranění,-,-,-,-,-,-,-,-,-,-,-,-,-,-,-,-,-,-,-,-,-,-,-
E929,Pozdní následky náhodných poranění,-,-,-,-,-,-,-,-,-,-,-,-,-,-,-,-,-,-,-,-,-,-,-
,,,,,,,,,,,,,,,,,,,,,,,,
,"Látky, chemické a biologické látky, vyvolavší nepříznivé účinky při léčebném použití",2,-,-,-,-,-,-,-,-,-,-,-,-,-,-,1,-,-,1,-,-,-,-
E930,Antibiotika,-,-,-,-,-,-,-,-,-,-,-,-,-,-,-,-,-,-,-,-,-,-,-
E931,Jiné prostředky proti infekcím,-,-,-,-,-,-,-,-,-,-,-,-,-,-,-,-,-,-,-,-,-,-,-
E932,Hormony a jejich syntetické náhrady,-,-,-,-,-,-,-,-,-,-,-,-,-,-,-,-,-,-,-,-,-,-,-
E933,Látky působící přímo na celý organismus,-,-,-,-,-,-,-,-,-,-,-,-,-,-,-,-,-,-,-,-,-,-,-
E934,Látky působící především na složky krve,-,-,-,-,-,-,-,-,-,-,-,-,-,-,-,-,-,-,-,-,-,-,-
E935,"Analgetika, antipyretika a antirevmatika",-,-,-,-,-,-,-,-,-,-,-,-,-,-,-,-,-,-,-,-,-,-,-
E936,Antikonvulzíva a léky proti Parkinsonově nemoci,-,-,-,-,-,-,-,-,-,-,-,-,-,-,-,-,-,-,-,-,-,-,-
E937,Sedativa  a hypnotika,-,-,-,-,-,-,-,-,-,-,-,-,-,-,-,-,-,-,-,-,-,-,-
E938,Jiné látky s tlumivým účinkem na centrální nervovou soustavu,-,-,-,-,-,-,-,-,-,-,-,-,-,-,-,-,-,-,-,-,-,-,-
E939,Psychofarmaka,1,-,-,-,-,-,-,-,-,-,-,-,-,-,-,1,-,-,-,-,-,-,-
E940,Stimulancia centrální nervové soustavy,-,-,-,-,-,-,-,-,-,-,-,-,-,-,-,-,-,-,-,-,-,-,-
E941,Látky působící především na autonomní nervovou soustavu,-,-,-,-,-,-,-,-,-,-,-,-,-,-,-,-,-,-,-,-,-,-,-
E942,Látky působící především na oběhovou soustavu,-,-,-,-,-,-,-,-,-,-,-,-,-,-,-,-,-,-,-,-,-,-,-
E943,Látky působící především na trávicí soustavu,-,-,-,-,-,-,-,-,-,-,-,-,-,-,-,-,-,-,-,-,-,-,-
E944,"Látky působící na metabolismus vody, minerálů a kyseliny močové",-,-,-,-,-,-,-,-,-,-,-,-,-,-,-,-,-,-,-,-,-,-,-
E945,Látky působící především na hladké nebo kosterní svaly nebo na dýchací soustavu,-,-,-,-,-,-,-,-,-,-,-,-,-,-,-,-,-,-,-,-,-,-,-
E946,"Látky působící především na kůži a sliznici, prostředky oftalmologické, otorinolaryngologické a stomatologické",-,-,-,-,-,-,-,-,-,-,-,-,-,-,-,-,-,-,-,-,-,-,-
E947,Jiné a NS léky a přípravky,1,-,-,-,-,-,-,-,-,-,-,-,-,-,-,-,-,-,1,-,-,-,-
E948,Očkovací látky proti bakteriím,-,-,-,-,-,-,-,-,-,-,-,-,-,-,-,-,-,-,-,-,-,-,-
E949,Jiné očkovací a biologické látky,-,-,-,-,-,-,-,-,-,-,-,-,-,-,-,-,-,-,-,-,-,-,-
,,,,,,,,,,,,,,,,,,,,,,,,
SE,Sebevraždy a sebopoškození,546,-,-,-,-,-,-,1,9,21,15,34,39,44,49,35,38,48,63,39,39,40,32
E950,Otrava pevnou nebo kapalnou látkou,75,-,-,-,-,-,-,-,1,3,2,8,6,12,14,7,1,10,2,1,3,3,2
E951,Otrava plynem používaným v domácnosti,57,-,-,-,-,-,-,-,4,3,2,3,4,6,5,3,-,5,5,1,6,5,5
E952,Otrava jiným plynem nebo výpary,18,-,-,-,-,-,-,-,-,2,2,2,2,1,3,1,1,-,2,1,-,-,1
E953,"Oběšení, uškrcení nebo udušení",237,-,-,-,-,-,-,-,-,3,2,8,14,11,16,17,22,21,37,23,24,23,16
E954, (U)topení,33,-,-,-,-,-,-,-,-,-,1,3,3,3,2,1,3,3,5,3,3,3,-
E955,Sebevražda nebo sebepoškození střelnou zbraní nebo výbušninou,6,-,-,-,-,-,-,-,-,-,-,1,1,1,-,-,2,-,1,-,-,-,-
E956,"Sebevražda nebo sebepoškození řezným, sečným nebo bodným nástrojem ",17,-,-,-,-,-,-,-,-,-,1,1,1,1,1,3,-,2,2,4,-,-,1
E957,Sebevražda nebo sebepoškození skokem s výše,72,-,-,-,-,-,-,1,3,7,4,6,7,5,4,3,4,6,6,4,3,3,6
E958,Sebevražda nebo sebepoškození jiným nebo NS způsobem,31,-,-,-,-,-,-,-,1,3,1,2,1,4,4,-,5,1,3,2,-,3,1
E959,Pozdní následky pokusu o sebevraždu nebo sebepoškození ,-,-,-,-,-,-,-,-,-,-,-,-,-,-,-,-,-,-,-,-,-,-,-
,,,,,,,,,,,,,,,,,,,,,,,,
NA,Usmrcení nebo poranění způsobená úmyslně jinými osobami,50,1,1,-,-,2,-,2,2,5,2,6,5,8,2,1,-,1,3,1,7,1,-
E960,"Zápas, rvačka, znásilnění",1,-,-,-,-,-,-,-,-,-,-,-,-,-,1,-,-,-,-,-,-,-,-
E961,"Napadení žíravou nebo leptavou látkou, mimo otravu",-,-,-,-,-,-,-,-,-,-,-,-,-,-,-,-,-,-,-,-,-,-,-
E962,Otrávení,-,-,-,-,-,-,-,-,-,-,-,-,-,-,-,-,-,-,-,-,-,-,-
E963,Oběšení nebo (u)škrcení,14,1,-,-,-,-,-,-,1,1,1,1,2,3,1,-,-,-,-,-,2,1,-
E964, (U)topení,1,-,-,-,-,1,-,-,-,-,-,-,-,-,-,-,-,-,-,-,-,-,-
E965,Napadení střelnou zbraní nebo výbušninou,6,-,-,-,-,-,-,1,-,1,-,1,-,1,-,-,-,-,1,-,1,-,-
E966,"Napadení řezným, sečným nebo bodným nástrojem ",14,-,-,-,-,-,-,1,-,3,1,-,2,3,-,-,-,1,1,1,1,-,-
E967,Bití nebo jiné týrání dítěte,1,-,1,-,-,-,-,-,-,-,-,-,-,-,-,-,-,-,-,-,-,-,-
E968,Napadení jiným nebo NS způsobem,13,-,-,-,-,1,-,-,1,-,-,4,1,1,-,1,-,-,1,-,3,-,-
E969,Pozdní následky poranění způsobeného úmyslně jinou osobou,-,-,-,-,-,-,-,-,-,-,-,-,-,-,-,-,-,-,-,-,-,-,-
,,,,,,,,,,,,,,,,,,,,,,,,
,Zákonný zákrok,-,-,-,-,-,-,-,-,-,-,-,-,-,-,-,-,-,-,-,-,-,-,-
E970,Zákonný zákrok střelnou zbraní,-,-,-,-,-,-,-,-,-,-,-,-,-,-,-,-,-,-,-,-,-,-,-
E971,Zákonný zákrok výbušninou,-,-,-,-,-,-,-,-,-,-,-,-,-,-,-,-,-,-,-,-,-,-,-
E972,Zákonný zákrok plynem,-,-,-,-,-,-,-,-,-,-,-,-,-,-,-,-,-,-,-,-,-,-,-
E973,Zákonný zákrok tupým předmětem,-,-,-,-,-,-,-,-,-,-,-,-,-,-,-,-,-,-,-,-,-,-,-
E974,"Zákonný zákrok řezným, sečným nebo bodným nástrojem",-,-,-,-,-,-,-,-,-,-,-,-,-,-,-,-,-,-,-,-,-,-,-
E975,Zákonný zákrok jiným popsaným způsobem,-,-,-,-,-,-,-,-,-,-,-,-,-,-,-,-,-,-,-,-,-,-,-
E976,Zákonný zákrok NS způsobem,-,-,-,-,-,-,-,-,-,-,-,-,-,-,-,-,-,-,-,-,-,-,-
E977,Pozdní následky poranění způsobeného zákonným zákrokem,-,-,-,-,-,-,-,-,-,-,-,-,-,-,-,-,-,-,-,-,-,-,-
E978,Zákonná poprava,-,-,-,-,-,-,-,-,-,-,-,-,-,-,-,-,-,-,-,-,-,-,-
,,,,,,,,,,,,,,,,,,,,,,,,
,"Poranění, o kterých nebylo zjištěno, zdali byla náhodná či způsobena úmyslně",128,1,-,-,-,-,2,1,2,3,2,2,5,4,5,8,2,7,8,10,30,24,12
E980,Otrava pevnou nebo kapalnou látkou,23,-,-,-,-,-,-,-,-,2,-,1,2,3,1,2,1,-,1,3,4,2,1
E981,Otrava plynem používaným v domácnosti,20,-,-,-,-,-,-,-,-,-,-,-,1,-,1,-,1,-,1,2,4,9,1
E982,Otrava jiným plynem nebo výpary,5,-,-,-,-,-,-,-,1,-,-,-,-,-,-,1,-,-,-,-,1,1,1
E983,"Oběšení, uškrcení nebo zadušení",1,-,-,-,-,-,-,-,-,-,-,-,-,-,-,-,-,-,1,-,-,-,-
E984,Utonutí,6,-,-,-,-,-,-,-,-,-,-,-,-,-,-,1,-,2,-,-,2,-,1
E985,Poranění střelnou zbraní nebo výbušninou,-,-,-,-,-,-,-,-,-,-,-,-,-,-,-,-,-,-,-,-,-,-,-
E986,"Poranění řezným, sečným nebo bodným nástrojem ",4,-,-,-,-,-,-,-,-,-,-,-,-,-,-,-,-,1,-,1,1,1,-
E987,Pád s výše,-,-,-,-,-,-,-,-,-,-,-,-,-,-,-,-,-,-,-,-,-,-,-
E988,Poranění jiným nebo NS způsobem,69,1,-,-,-,-,2,1,1,1,2,1,2,1,3,4,-,4,5,4,18,11,8
E989,"Pozdní následky poranění, o ketrých nebylo zjištěno zda byla náhodná či způsobena úmyslně ",-,-,-,-,-,-,-,-,-,-,-,-,-,-,-,-,-,-,-,-,-,-,-
,,,,,,,,,,,,,,,,,,,,,,,,
,Poranění vzniklá válečnými operacemi,-,-,-,-,-,-,-,-,-,-,-,-,-,-,-,-,-,-,-,-,-,-,-